id ,name ,type ,address ,TicketPrice ,OpeningHours ,Suggestedtraveltime,Suggestedtraveltime,units,attractionlevel,number,introduction,Scenery,Howtogo,Scenicspotsaround,,cover
1,故宫博物院,综合类,北京市东城区景山前街4号,60,8:00~17:00（周一闭馆）,3~4小时,国家一级（文物）,国家第一批(明、清),2007年(5A),3376,北京故宫博物院，紫禁城，皇家宫殿，国家5A级旅游景点，世界五大宫之首，世界文化遗产。故宫博物院建立于1925年10月10日，位于北京故宫紫禁城内，是在明朝、清朝两代皇宫及其收藏的基础上建立起来的中国综合性博物馆，其文物收藏主要来源于清代宫中旧藏，是第一批全国爱国主义教育示范基地。北京故宫是第一批全国重点文物保护单位、第一批国家5A级旅游景区，1987年入选《世界文化遗产名录》。,,"公交车：（一）故宫博物院午门（南门）：天安门东站和天安西站。午门是唯一观众入口。

1、天安门东站：1路、2路、10路、20路、82路、120路、37路、52路、126路、99路、203路、205路、210路、728路、专1路、专2路。下车后直接步行经端门到达故宫午门（南门）。

2、天安门西站。1路、10路、37路、52路、99路、205路、728路、5路、22路、专1路、专2路。下车后直接步行经端门到达故宫午门（南门）。

（二）故宫博物院神武门（北门）：故宫站和景山公园东门站。神武门是唯一观众出口。

1、故宫站：101路、103路、109路、202路夜班、211路夜班、685路、619路、614路、609路、专1路、专2路、124路无轨电车。

2、景山公园东门站：111路无轨电车。

故宫博物院东华门（东门）和西华门（西门）平时仅做工作人员通道。

地铁1号线：天安门东站或天安门西站","普度寺(1km),大高玄殿(1km),社稷坛(1km),天安门(1km),北京燕龙温泉度假村(1km),北京市劳动人民文化宫(1km),景山公园(1km),中山公园(1km),老舍纪念馆(1km),故宫房屋数量之谜(2km),北海白塔(2km),北京香裕村(2km),溶岩美术馆(2km),北京银河公园(2km),半月公园(2km),杜聿明故居(2km),北京长安街(2km),后门桥(2km),通运桥(2km),礼王府(2km),淳亲王府(2km),王府井大街(2km),天安门广场(2km),北京东方新天地(2km),首都剧场(2km),中国国家大剧院(2km),西交民巷近代银行建筑群(2km),东堂(2km),西什库教堂(2km),北平图书馆旧址(2km),协和医学院旧址(2km),中南海(2km),东交民巷使馆建筑群(2km),太庙(2km),皇史k(2km),北海及团城(2km),人民英雄纪念碑(2km),北京大学红楼(2km),北京北海公园(2km),北京市规划展览馆(2km),中国法院博物馆(2km),中国铁道博物馆正阳门馆(2km),北京人民艺术剧院戏剧博物馆(2km),北京皇城艺术馆(2km),北京王府井古人类文化遗址博物馆(2km),北京警察博物馆(2km),北京工艺美术博物馆(2km),中国钱币博物馆(2km),正阳门(2km),毛主席纪念堂(2km),中国美术馆(2km),中国国家博物馆(2km),府学文庙(3km),北京市东城区第一文化馆(3km),琉璃厂文化街(3km),东单公园(3km),银锭桥(3km),涛贝勒府(3km),郑王府(3km),睿亲王府(3km),庆亲王府(3km),南锣鼓巷(3km),西单大悦城(3km),北京四合院(3km),北京大学地质学馆旧址(3km),基督教中华圣经会北京分会旧址(3km),辅仁大学本部旧址(3km),克勤郡王府(3km),万松老人塔(3km),京师女子师范学堂旧址(3km),北京国会旧址(3km),国立蒙藏学校旧址(3km),亚斯立堂(3km),清陆军部和海军部旧址(3km),孙中山行馆(3km),安徽会馆(3km),孚王府(3km),可园(3km),南堂(3km),崇礼住宅(3km),郭沫若故居(3km),智华寺(3km),妙应寺白塔(3km),明北京城城墙遗存(3km),牛驼温泉孔雀城(3km),北京市大栅栏商业街区(3km),大观楼影城(3km),北京老舍茶馆(3km),前门大街景区(3km),火德真君庙(3km),北京广化寺(3km),北京广济寺(3km),盛锡福博物馆(3km),中国妇女儿童博物馆(3km),历代帝王庙(3km),北京茅盾故居(3km),北京钟鼓楼(3km),文天祥祠(3km),北京市白塔寺(3km),梅兰芳纪念馆(3km),郭沫若纪念馆(3km),民族文化宫博物馆(3km),恭王府博物馆(3km),中国地质博物馆(3km),恭王府景区(3km),北京市西城区第一文化馆(4km),北京市东城区第二文化馆(4km),北京湖广会馆(4km),菜市口刑场(4km),官园公园(4km),南礼士路公园(4km),北二环城市公园(4km),南馆公园(4km),北京什刹海地区(4km),石库门景区(4km),簋街(4km),北京金融街购物中心(4km),北京保利国际剧院(4km),北京后海(4km),北京关岳庙(4km),基督教中华圣公会教堂(4km),德胜门箭楼(4km),柏林寺(4km),醇亲王府(4km),北京孔庙(4km),古观象台(4km),国子监(4km),北京金龙建国温泉酒店(4km),日坛公园(4km),北京湖广会馆大戏楼(4km),北京古钱币展览馆(4km),北京月坛公园(4km),南新仓文化休闲街景区(4km),什刹海风景区(4km),明城墙遗址公园(4km),吕祖宫(4km),雍和宫(4km),通教寺(4km),北京松堂斋民间雕刻博物馆(4km),保利艺术博物馆(4km),中国海关博物馆(4km),北京通信电信博物馆(4km),北京李大钊故居(4km),北京宣南文化博物馆(4km),北京戏曲博物馆(4km),北京市东南城角角楼(4km),郭守敬纪念馆(4km),北京古代钱币博物馆(4km),雍和宫藏传佛教艺术博物馆(4km),中国邮政邮票博物馆(4km),宋庆龄故居(4km),北京文博交流馆(4km),孔庙国子监博物馆(4km),北京自然博物馆(4km),北京鲁迅博物馆(4km),建业・华谊兄弟电影小镇(5km),富国海底世界(5km),北京三圣庵(5km),北京滨河公园(5km),滨河公园(5km),万寿公园(5km),永定门公园(5km),人定湖公园(5km),柳荫公园(5km),高粱桥(5km),北京工人体育场(5km),北京工人体育场冰灯游园会(5km),嘉茂购物中心(5km),世贸天阶(5km),京师大学堂分科大学旧址(5km),报国寺(5km),袁崇焕墓和祠(5km),利玛窦和外国传教士墓地(5km),先农坛(5km),牛街礼拜寺(5km),北京城东南角楼(5km),京城百工坊(5km),北京市宣武艺园(5km),青年湖公园(5km),地坛公园(5km),北京东岳庙(5km),北京白云观(5km),北京法源寺(5km),北京空竹博物馆(5km),北京自来水博物馆(5km),中国佛教图书文物馆(5km),北京民俗博物馆(5km),北京古代建筑博物馆(5km),首都博物馆(5km),天坛公园(5km),咸通塔（天宁寺塔）(6km),西黄寺(6km),南二环护城河公园(6km),玉蜓公园(6km),龙潭西湖公园(6km),双秀公园(6km),中央电视台总部大楼(6km),国贸商城(6km),三里屯太古里(6km),北京银泰中心(6km),国民政府财政部印刷局旧址(6km),天宁寺塔(6km),摩力圣汇温泉会馆(6km),团结湖公园(6km),陶然亭公园(6km),北京海洋馆(6km),北京动物园(6km),龙潭公园(6km),北京天宁寺(6km),北京英杰硬石艺术博物馆(6km),北京百年世界老电话博物馆(6km),北京百工博物馆(6km),中国印钞造币博物馆(6km),北京慈悲庵(6km),中国古动物馆(6km),北京天文馆(6km),克什克腾大草原(7km),1958文化创意园(7km),宋庆龄儿童科学技术馆(7km),北京市朝阳区文化馆(7km),澳门消防博物馆(7km),万芳亭公园(7km),马甸公园(7km),北京南站(7km),呀诺达热带雨林景区(7km),燕莎友谊商城(7km),中国国家图书馆(7km),清农事试验场旧址(7km),北京鲁迅旧居(7km),大慧寺(7km),金中都水关遗址(7km),真觉寺金刚宝座(五塔寺塔)(7km),热公馆温泉酒店(7km),庆丰公园(7km),金中都公园(7km),北京大观园(7km),玉渊潭公园(7km),元大都城垣遗址公园(7km),古陶文明博物馆(7km),北京中华民族博物院(7km),北京金台艺术馆(7km),中国消防博物馆(7km),北京服装学院民族服饰博物馆(7km),中华世纪坛世界艺术馆(7km),北京中医药大学中医药博物馆(7km),北京红楼文化艺术博物馆(7km),北京辽金城垣博物馆(7km),北京石刻艺术博物馆(7km),中国铁道博物馆(7km),中国农业博物馆(7km),中国人民革命军事博物馆(7km),湘江战役遗址公园(8km),中华民族园(8km),中央电视塔旋转餐厅(8km),SOLANA蓝色港湾(8km),北京新光天地百货(8km),万寿寺(8km),大红门温泉(8km),北京京瑞国都温泉会馆(8km),莲花池公园(8km),太平洋海底世界博览馆(8km),北京蓝色港湾(8km),紫竹院公园(8km),中央广播电视塔(8km),朝阳公园(8km),和苑博物馆(8km),中国现代文学馆(8km),中国国家画院美术馆(8km),中央民族大学民族博物馆(8km),北京艺术博物馆(8km),中国电信博物馆(8km),大钟寺古钟博物馆(8km),红岩峡谷(9km),十里河滩(9km),玲珑公园(9km),钓鱼台银杏大道(9km),勇敢者乐园(9km),国家体育场(鸟巢)(9km),北京水立方嬉水乐园(9km),慈寿寺塔(9km),摩诃庵(9km),北京华夏名都温泉酒店(9km),顺景温泉酒店(9km),万方亭公园(9km),红领巾公园(9km),炎黄艺术馆(9km),北京奥运博物馆(9km),中国藏学研究中心西藏文化博物馆(9km),北京航空航天模型博物馆(9km),北京航空馆(9km),仙湖景区(10km),北京市海淀区文化馆(10km),国家动物博物馆(10km),香港竹林禅院(10km),丽都公园(10km),新中关购物中心(10km),汉拿山汤泉国际酒店(10km),北京行宫温泉(10km),北京陶瓷艺术馆(10km),四得公园(10km),世界花卉大观园(10km),北京晋商博物馆(10km),中国人民大学博物馆(10km),中国科学院动物研究所标本展示馆(10km),北京市海淀区博物馆(10km),中央美术学院美术馆(10km),中国科学技术馆(10km),北京市奥林匹克公园(10km),北京市奥林匹克公园(10km)",,/RuoYi-Vue/coverpic/1.jpg
2,中国国家博物馆,综合性,北京市东城区东长安街16号,0,9：00-17：00（周一闭馆）,3-4小时,国家一级（文物）,,,56614,中国国家博物馆简称国博，位于北京市中心天安门广场东侧，东长安街南侧，与人民大会堂东西相对称，是历史与艺术并重，集收藏、展览、研究、考古、公共教育、文化交流于一体的综合性博物馆，隶属于中华人民共和国文化部。中国国家博物馆现有藏品数量140余万件，涵盖古代文物、近现代文物、图书古籍善本、艺术品等多种门类。其中，古代文物藏品81.5万件（套），近现代文物藏品34万件（套），图书古籍善本24万余件（册），共有一级文物近6000件（套）。,,"公交：天安门东站：途经公交车：1、10、120、126、2、20、203、205、210、37、52、59、728、82、90内、90外、99、专1、专2

天安门广场东站：途经公交车：120、126、2、20、203、210、22、5、专1、专2

前门站：途径公交车：120、127、17、20、203、22、301、48、5、59、626、646、66、67、69、690、692、71、723、729、8、快速公交1线、特11、特7、特4、专1、专2

前门西站：途径公交车：212、301、337、44内、44外、608、67、673、9、901快、特2、特4、特7

前门东站：途径公交车：201、209、44内、44外、673、729、8、9、特2

地铁：1号线：天安门东站；2号线：前门站

自驾车：国博地下停车场尚未对外开放，建议观众乘坐公共交通前来参观。","北京香裕村(1km),北京银河公园(1km),半月公园(1km),北京长安街(1km),后门桥(1km),通运桥(1km),淳亲王府(1km),天安门广场(1km),普度寺(1km),东交民巷使馆建筑群(1km),社稷坛(1km),太庙(1km),皇史k(1km),人民英雄纪念碑(1km),天安门(1km),北京市劳动人民文化宫(1km),北京市大栅栏商业街区(1km),北京老舍茶馆(1km),前门大街景区(1km),中山公园(1km),北京市规划展览馆(1km),中国法院博物馆(1km),中国铁道博物馆正阳门馆(1km),北京皇城艺术馆(1km),北京警察博物馆(1km),中国钱币博物馆(1km),正阳门(1km),毛主席纪念堂(1km),北京市东城区第二文化馆(2km),老舍故居(2km),琉璃厂文化街(2km),东单公园(2km),王府井大街(2km),北京东方新天地(2km),中国国家大剧院(2km),北京四合院(2km),西交民巷近代银行建筑群(2km),东堂(2km),亚斯立堂(2km),协和医学院旧址(2km),中南海(2km),大观楼影城(2km),中国妇女儿童博物馆(2km),北京人民艺术剧院戏剧博物馆(2km),北京王府井古人类文化遗址博物馆(2km),北京工艺美术博物馆(2km),老舍纪念馆(2km),故宫博物院(2km),北海白塔(3km),北京湖广会馆(3km),菜市口刑场(3km),溶岩美术馆(3km),杜聿明故居(3km),礼王府(3km),郑王府(3km),西单大悦城(3km),首都剧场(3km),基督教中华圣经会北京分会旧址(3km),基督教中华圣公会教堂(3km),克勤郡王府(3km),京师女子师范学堂旧址(3km),北京国会旧址(3km),国立蒙藏学校旧址(3km),西什库教堂(3km),北平图书馆旧址(3km),安徽会馆(3km),南堂(3km),大高玄殿(3km),北京城东南角楼(3km),古观象台(3km),北京大学红楼(3km),北京燕龙温泉度假村(3km),北京金龙建国温泉酒店(3km),北京湖广会馆大戏楼(3km),景山公园(3km),北京北海公园(3km),明城墙遗址公园(3km),盛锡福博物馆(3km),中国海关博物馆(3km),北京通信电信博物馆(3km),北京戏曲博物馆(3km),北京市东南城角角楼(3km),中国邮政邮票博物馆(3km),民族文化宫博物馆(3km),中国美术馆(3km),北京文博交流馆(3km),北京自然博物馆(3km),天坛公园(3km),府学文庙(4km),北京三圣庵(4km),永定门公园(4km),玉蜓公园(4km),银锭桥(4km),涛贝勒府(4km),睿亲王府(4km),庆亲王府(4km),南锣鼓巷(4km),北京金融街购物中心(4km),北京大学地质学馆旧址(4km),辅仁大学本部旧址(4km),万松老人塔(4km),清陆军部和海军部旧址(4km),孙中山行馆(4km),报国寺(4km),袁崇焕墓和祠(4km),先农坛(4km),孚王府(4km),可园(4km),牛街礼拜寺(4km),崇礼住宅(4km),郭沫若故居(4km),智华寺(4km),北海及团城(4km),妙应寺白塔(4km),明北京城城墙遗存(4km),牛驼温泉孔雀城(4km),京城百工坊(4km),日坛公园(4km),北京市宣武艺园(4km),南新仓文化休闲街景区(4km),陶然亭公园(4km),吕祖宫(4km),火德真君庙(4km),北京法源寺(4km),北京广济寺(4km),历代帝王庙(4km),北京李大钊故居(4km),北京百工博物馆(4km),北京宣南文化博物馆(4km),北京慈悲庵(4km),北京茅盾故居(4km),文天祥祠(4km),北京市白塔寺(4km),中国佛教图书文物馆(4km),梅兰芳纪念馆(4km),郭沫若纪念馆(4km),恭王府博物馆(4km),北京古代建筑博物馆(4km),中国地质博物馆(4km),恭王府景区(4km),北京市西城区第一文化馆(5km),北京市东城区第一文化馆(5km),富国海底世界(5km),咸通塔（天宁寺塔）(5km),北京滨河公园(5km),滨河公园(5km),万寿公园(5km),龙潭西湖公园(5km),官园公园(5km),南礼士路公园(5km),北二环城市公园(5km),南馆公园(5km),北京工人体育场(5km),北京南站(5km),石库门景区(5km),簋街(5km),北京工人体育场冰灯游园会(5km),国贸商城(5km),世贸天阶(5km),北京银泰中心(5km),北京保利国际剧院(5km),北京后海(5km),北京关岳庙(5km),国民政府财政部印刷局旧址(5km),柏林寺(5km),醇亲王府(5km),天宁寺塔(5km),北京孔庙(5km),国子监(5km),摩力圣汇温泉会馆(5km),北京月坛公园(5km),龙潭公园(5km),北京东岳庙(5km),北京白云观(5km),北京天宁寺(5km),北京广化寺(5km),雍和宫(5km),通教寺(5km),北京松堂斋民间雕刻博物馆(5km),保利艺术博物馆(5km),北京空竹博物馆(5km),北京钟鼓楼(5km),雍和宫藏传佛教艺术博物馆(5km),宋庆龄故居(5km),北京民俗博物馆(5km),孔庙国子监博物馆(5km),北京鲁迅博物馆(5km),建业・华谊兄弟电影小镇(6km),北京市朝阳区文化馆(6km),澳门消防博物馆(6km),南二环护城河公园(6km),万芳亭公园(6km),人定湖公园(6km),北京什刹海地区(6km),中央电视台总部大楼(6km),呀诺达热带雨林景区(6km),三里屯太古里(6km),嘉茂购物中心(6km),北京鲁迅旧居(6km),京师大学堂分科大学旧址(6km),德胜门箭楼(6km),利玛窦和外国传教士墓地(6km),热公馆温泉酒店(6km),庆丰公园(6km),团结湖公园(6km),金中都公园(6km),北京大观园(6km),北京古钱币展览馆(6km),青年湖公园(6km),什刹海风景区(6km),地坛公园(6km),北京英杰硬石艺术博物馆(6km),古陶文明博物馆(6km),中国消防博物馆(6km),北京自来水博物馆(6km),北京红楼文化艺术博物馆(6km),郭守敬纪念馆(6km),北京古代钱币博物馆(6km),首都博物馆(6km),十里河滩(7km),西黄寺(7km),柳荫公园(7km),高粱桥(7km),北京新光天地百货(7km),金中都水关遗址(7km),大红门温泉(7km),北京京瑞国都温泉会馆(7km),万方亭公园(7km),北京海洋馆(7km),北京动物园(7km),北京百年世界老电话博物馆(7km),中国印钞造币博物馆(7km),中华世纪坛世界艺术馆(7km),中国古动物馆(7km),北京辽金城垣博物馆(7km),中国铁道博物馆(7km),北京天文馆(7km),中国农业博物馆(7km),中国人民革命军事博物馆(7km),红岩峡谷(8km),1958文化创意园(8km),宋庆龄儿童科学技术馆(8km),马甸公园(8km),双秀公园(8km),钓鱼台银杏大道(8km),燕莎友谊商城(8km),SOLANA蓝色港湾(8km),中国国家图书馆(8km),清农事试验场旧址(8km),真觉寺金刚宝座(五塔寺塔)(8km),莲花池公园(8km),北京蓝色港湾(8km),玉渊潭公园(8km),元大都城垣遗址公园(8km),北京金台艺术馆(8km),北京中医药大学中医药博物馆(8km),北京石刻艺术博物馆(8km),克什克腾大草原(9km),湘江战役遗址公园(9km),中华民族园(9km),中央电视塔旋转餐厅(9km),勇敢者乐园(9km),万寿寺(9km),大慧寺(9km),太平洋海底世界博览馆(9km),北京陶瓷艺术馆(9km),红领巾公园(9km),世界花卉大观园(9km),紫竹院公园(9km),中央广播电视塔(9km),朝阳公园(9km),北京欢乐谷(9km),北京晋商博物馆(9km),北京中华民族博物院(9km),和苑博物馆(9km),北京服装学院民族服饰博物馆(9km),中国国家画院美术馆(9km),中央民族大学民族博物馆(9km),北京艺术博物馆(9km),大钟寺古钟博物馆(9km),玲珑公园(10km),国家体育场(鸟巢)(10km),北京水立方嬉水乐园(10km),慈寿寺塔(10km),摩诃庵(10km),西国贸水会(10km),北京行宫温泉(10km),北京华夏名都温泉酒店(10km),顺景温泉酒店(10km),四得公园(10km),北京奥运博物馆(10km),中国藏学研究中心西藏文化博物馆(10km),中国现代文学馆(10km),中国电信博物馆(10km),中国电信博物馆(10km)",,/RuoYi-Vue/coverpic/2.jpg
3,上海科技馆,自然科学类,上海市浦东新区世纪大道2000号,45,09:00~17:15,4~8小时,国家一级（行业）,,2010年(5A),3684,上海科技馆是上海市人民政府为贯彻落实科教兴国战略，提高城市综合竞争力和市民科学文化素养而投资兴建的具有中国特色、时代特征、上海特点的综合性的自然科学技术博物馆，是对公众进行科普教育的公益性机构，是中国重要的科普教育基地和精神文明建设基地。上海科技馆主馆于2001年12月18日正式对外开放，是中国通过ISO9000/14000国际质量/环境标准认证的科技馆，已经成为国家AAAAA级科普旅游景点。,,"科技馆周边

乘地铁换乘 / 乘坐2号线到上海科技馆站下

乘公交东周线、隧道三线、申崇二线、申崇四线、公交 640、794、815、984、638、983、184、975 路

机场方向游客

上海浦东国际机场游客乘坐2号线 至广兰路站换乘直达上海科技馆站

上海虹桥机场游客乘坐10号线至南京东站换乘2号线直达上海科技馆站

火车站方向游客

上海火车站游客乘坐1号线至人民广场站换乘2号线直达上海科技馆站

上海南站游客乘坐1号线至人民广场站换乘2号线直达上海科技馆站

上海虹桥火车站游客乘坐 10号线至南京东路站换乘2号线直达上海科技馆站","上海世纪公园(2km),明仕田园(3km),新上海商业城(3km),上海陆家嘴(3km),上海名人苑(4km),老码头景区(4km),滨江大道(4km),上海金茂大厦(4km),上海环球金融中心(4km),上海中心大厦(4km),上海环球金融中心观光厅(4km),上海隧道科技馆(4km),横门村红树林(5km),上海老街(5km),上海惠民公园(5km),上海蓬莱公园(5km),上海古城公园(5km),临沂公园(5km),霍山公园(5km),上海当代艺术博物馆(5km),上海正大广场(5km),豫园上海滩商厦(5km),上海外滩(5km),杨树浦水厂(5km),上海外滩建筑群(5km),上海海洋水族馆(5km),上海城隍庙(5km),沉香阁(5km),上海震旦博物馆(5km),历道证券博物馆(5km),上海吴昌硕纪念馆(5km),上海杨浦法院博物馆(5km),国歌展示馆(5km),上海犹太难民纪念馆(5km),上海豫园(5km),上海市银行博物馆(5km),上海东方明珠广播电视塔(5km),星岛湖景区(6km),上海长泰广场(6km),圣三一基督教堂(6km),世博会中国馆(6km),梅赛德斯－奔驰文化中心(6km),平凉公园(6km),江浦公园(6km),上海人民公园(6km),外白渡桥(6km),多利农庄(6km),悦来古镇(6km),上海南京东路(6km),上海和平饭店(6km),提篮桥监狱早期建筑(6km),上海电信博物馆(6km),上海三山会馆(6km),上海中国烟草博物馆(6km),上海世博会博物馆(7km),上海青青旅游世界(7km),上海市历史博物馆(7km),上海音乐谷景区(7km),上海中医药博物馆(7km),杨浦公园(7km),复兴公园(7km),淮海公园(7km),上海和平公园(7km),梅兰芳故居(7km),周恩来故居(7km),上海大光明电影院(7km),五卅运动纪念碑(7km),上海大世界(7km),上海世博园(7km),上海新天地(7km),上海美术馆(7km),上海大剧院(7km),上海人民广场(7km),中国共产党第二次全国代表大会会址(7km),国际饭店(7km),中国共产党第一次全国代表大会会址(7km),中国社会主义青年团中央机关旧址(7km),极乐汤碧云温泉馆(7km),上海杜莎夫人蜡像馆(7km),上海国际时尚中心(7km),上海城市规划展示馆(7km),上海金刚博物馆(7km),上海动漫博物馆(7km),沈尹默故居(7km),上海理工大学印刷博物馆(7km),上海邮政博物馆(7km),中共四大纪念馆(7km),上海韬奋纪念馆(7km),中国共产党第一次全国代表大会会址纪念馆(7km),上海博物馆(7km),上海市浦东新区浦南文化馆(8km),上南公园(8km),鲁迅故居(8km),上海吴江路(8km),上海甜爱路(8km),复兴岛公园(8km),静安雕塑公园(8km),田子坊(8km),上海四川北路(8km),上海世博园冰雕展(8km),法善庵(8km),上海琉璃艺术博物馆(8km),中国左翼作家联盟成立大会会址纪念馆(8km),中共三大后中央局机关历史纪念馆(8km),中国社会主义青年团中央机关旧址纪念馆(8km),中国共产党代表团驻沪办事处纪念馆(8km),上海海洋大学博物馆(8km),李白烈士故居(8km),上海四行仓库抗战纪念馆(8km),上海铁路博物馆(8km),中共二大会址纪念馆(8km),江南造船博物馆(8km),上海自然博物馆(8km),上海公安博物馆(8km),上海孙中山故居纪念馆(8km),上海鲁迅纪念馆(8km),黄兴公园(9km),上海市襄阳公园(9km),济阳公园(9km),西康公园(9km),张爱玲故居(9km),上海浦东滨江大道(9km),上海鲁迅公园(9km),上海恒隆广场(9km),上海淮海中路(9km),上海南京西路(9km),上海邮政总局(9km),鲁迅墓(9km),上海宝华寺(9km),上海眼镜博物馆(9km),上海院士风采馆(9km),中国科学院上海昆虫博物馆(9km),中国劳动组合书记部旧址陈列馆(9km),上海工艺美术博物馆(9km),七贤民俗村(10km),九沟风景区(10km),上海龙华寺(10km),上海玉佛寺(10km),百乐门(10km),上海M50创意园(10km),东安公园(10km),徐家汇公园(10km),静安公园(10km),巴金故居(10km),上海衡山路(10km),葛山风景区(10km),龙华烈士陵园(10km),上海五角场(10km),龙华塔(10km),龙华革命烈士纪念地(10km),上海泛洋城市度假村(10km),圆明讲堂(10km),上海玉佛禅寺(10km),上海静安寺(10km),上海龙华古寺(10km),复旦大学博物馆(10km),上海体育学院中国武术博物馆(10km),中共上海地下组织斗争史陈列馆(10km),上海宋庆龄故居纪念馆(10km),上海宋庆龄故居纪念馆(10km)",,/RuoYi-Vue/coverpic/3.jpg
