id ,name ,type ,address ,TicketPrice ,OpeningHours ,Suggestedtraveltime,Suggestedtraveltime,units,attractionlevel,number,introduction,Scenery,Howtogo,Scenicspotsaround,,cover
163,中国共产党第一次全国代表大会会址纪念馆,历史类,上海市黄浦区兴业路76号,0,09:00~17:00周一闭馆,2小时,国家一级（文物）,,,57661,中国共产党第一次全国代表大会会址纪念馆，简称中共一大会址，是中国共产党的诞生地，现在是介绍中国共产党诞生史迹的革命旧址纪念馆。其建于1952年，由“一大”会议室、中共创建史陈列室和革命史专题临时陈列室3部分组成。中共一大会址先后被国务院列为第一批全国重点文物保护单位，成为全国爱国主义教育示范基地、全国中小学生研学实践教育基地，还入选“首批中国20世纪建筑遗产”名录。,,"上海轨道交通：1号线黄陂南路站、10号线新天地站

公交：146、42、109、911、926路、934路、大桥一线","淮海公园(1km),梅兰芳故居(1km),周恩来故居(1km),上海大世界(1km),上海新天地(1km),中国共产党第二次全国代表大会会址(1km),中国共产党第一次全国代表大会会址(1km),上海金刚博物馆(1km),上海韬奋纪念馆(1km),上海孙中山故居纪念馆(1km),上海博物馆(1km),上海青青旅游世界(2km),星岛湖景区(2km),上海市历史博物馆(2km),上海市襄阳公园(2km),上海人民公园(2km),上海大光明电影院(2km),上海吴江路(2km),五卅运动纪念碑(2km),悦来古镇(2km),静安雕塑公园(2km),田子坊(2km),豫园上海滩商厦(2km),上海淮海中路(2km),上海世博园冰雕展(2km),上海大剧院(2km),上海人民广场(2km),国际饭店(2km),中国社会主义青年团中央机关旧址(2km),上海杜莎夫人蜡像馆(2km),上海城市规划展示馆(2km),上海城隍庙(2km),沉香阁(2km),上海震旦博物馆(2km),上海电信博物馆(2km),中国社会主义青年团中央机关旧址纪念馆(2km),中国共产党代表团驻沪办事处纪念馆(2km),上海四行仓库抗战纪念馆(2km),中共二大会址纪念馆(2km),上海豫园(2km),上海世博会博物馆(3km),上海老街(3km),圣三一基督教堂(3km),百乐门(3km),老码头景区(3km),上海蓬莱公园(3km),上海古城公园(3km),西康公园(3km),静安公园(3km),外白渡桥(3km),张爱玲故居(3km),上海正大广场(3km),上海恒隆广场(3km),上海南京西路(3km),上海南京东路(3km),上海和平饭店(3km),上海外滩(3km),上海外滩建筑群(3km),上海宝华寺(3km),上海静安寺(3km),历道证券博物馆(3km),上海琉璃艺术博物馆(3km),中共三大后中央局机关历史纪念馆(3km),上海三山会馆(3km),上海吴昌硕纪念馆(3km),上海邮政博物馆(3km),上海铁路博物馆(3km),中国劳动组合书记部旧址陈列馆(3km),上海隧道科技馆(3km),上海自然博物馆(3km),上海市银行博物馆(3km),上海工艺美术博物馆(3km),上海公安博物馆(3km),横门村红树林(4km),九沟风景区(4km),梅赛德斯－奔驰文化中心(4km),上海玉佛寺(4km),上海名人苑(4km),徐家汇公园(4km),巴金故居(4km),上海衡山路(4km),葛山风景区(4km),上海世博园(4km),上海当代艺术博物馆(4km),新上海商业城(4km),上海金茂大厦(4km),上海环球金融中心(4km),上海中心大厦(4km),上海泛洋城市度假村(4km),上海环球金融中心观光厅(4km),上海海洋水族馆(4km),圆明讲堂(4km),上海玉佛禅寺(4km),沈尹默故居(4km),上海眼镜博物馆(4km),中共四大纪念馆(4km),中国科学院上海昆虫博物馆(4km),中共上海地下组织斗争史陈列馆(4km),江南造船博物馆(4km),上海宋庆龄故居纪念馆(4km),上海东方明珠广播电视塔(4km),世博会中国馆(5km),上海音乐谷景区(5km),上海M50创意园(5km),东安公园(5km),临沂公园(5km),多利农庄(5km),上海浦东滨江大道(5km),上海徐家汇(5km),上海四川北路(5km),徐家汇天主堂(5km),上海徐家汇源景区(5km),上海纺织博物馆(5km),中国左翼作家联盟成立大会会址纪念馆(5km),国歌展示馆(5km),上海犹太难民纪念馆(5km),李白烈士故居(5km),顾正红纪念馆(5km),上海LV大厦(6km),上海龙华寺(6km),长海天山公园(6km),上海中山公园(6km),闸北公园(6km),光启公园(6km),普陀公园(6km),宜川公园(6km),济阳公园(6km),滨江大道(6km),霍山公园(6km),鲁迅故居(6km),上海甜爱路(6km),上海体育场(6km),上海鲁迅公园(6km),龙华烈士陵园(6km),上海陆家嘴(6km),上海美术馆(6km),提篮桥监狱早期建筑(6km),杨树浦水厂(6km),龙华塔(6km),徐光启墓(6km),龙华革命烈士纪念地(6km),鲁迅墓(6km),上海龙华古寺(6km),上海交通大学董浩云航运博物馆(6km),上海中国烟草博物馆(6km),上海凝聚力工程博物馆(6km),上海市长宁区革命文物陈列馆(6km),上海交通大学钱学森图书馆(6km),上海交通大学校史博物馆(6km),上海鲁迅纪念馆(6km),七贤民俗村(7km),明仕田园(7km),上海市群众艺术馆(7km),上海市浦东新区浦南文化馆(7km),上海惠民公园(7km),虹桥公园(7km),大宁灵石公园(7km),江浦公园(7km),漕溪公园(7km),曹杨公园(7km),沪太公园(7km),武宁公园(7km),上南公园(7km),上海和平公园(7km),上海东方艺术中心(7km),志丹苑元代水闸遗址(7km),上海邮政总局(7km),宋庆龄墓(7km),上海艺术礼品博物馆(7km),上海消防博物馆(7km),上海杨浦法院博物馆(7km),上海电影博物馆(7km),上海龙华烈士纪念馆(7km),上海土山湾博物馆(7km),徐光启纪念馆(7km),上海元代水闸遗址博物馆(7km),上海科技馆(7km),东江(8km),兰溪青年公园(8km),真如寺大殿(8km),上海长风公园・长风海洋世界景区(8km),上海世纪公园(8km),上海真如寺(8km),宋庆龄生平事迹陈列馆(8km),上海儿童博物馆(8km),上海长宁文化艺术中心(9km),水霞公园(9km),天原公园(9km),杨浦公园(9km),平凉公园(9km),海棠公园(9km),海洋银杏林(9km),上海桂林公园(9km),上海植物园(9km),法善庵(9km),上海市陶行知纪念馆(9km),上海理工大学印刷博物馆(9km),复旦大学博物馆(9km),上海院士风采馆(9km),李小龙乐园(10km),上海长宁民俗文化中心(10km),彭浦公园(10km),黄兴公园(10km),清涧公园(10km),上海五角场(10km),上海国际时尚中心(10km),上海海洋大学博物馆(10km),上海师范大学博物馆(10km),上海师范大学博物馆(10km)",,/RuoYi-Vue/coverpic/163.jpg
164,大庆市博物馆,综合类,黑龙江省大庆市龙凤区文苑街2,0,周一，周三~周日：9:00~16:00,,国家一级（文物）,,4A,57467,大庆博物馆是大庆市综合性博物馆，新馆前身为大庆展览馆，于1964年组建，曾经在油田开发建设的各个历史阶段为宣传大庆精神和铁人精神发挥了重要作用。大庆博物馆新馆位于大庆市开发区火炬新街教育文化中心，建筑面积18700平方米，与大庆歌剧院、大庆书苑比肩相接，成为大庆五湖新区较具现代风格和特色的组团建筑，成为开放的大庆对外展示的重要窗口。大庆博物馆为国家一级博物馆、全国科普教育基地。大庆博物馆基本陈列主要有《东北第四纪哺乳动物》、《大庆古代历史》和《东北第四纪自然环境》。,,乘坐公交车去大庆博物馆参观的市民，可乘35路、50路公交车到高新区大庆书苑站下车；也可乘106路、225路到市人民医院站下车，再步行10多分钟，前往大庆博物馆。,"大庆黎明湖旅游区(2km),北二十里泡(3km),万宝湖(4km),大庆市大庆科技馆(5km),大庆广播电视塔(6km),大庆石油馆(6km),大庆龙凤湿地(7km),黑龙江大兴安岭九曲十八湾国家湿地公园(10km),黑龙江大兴安岭古里河国家湿地公园(10km),黑龙江大海林二浪河国家湿地公园(10km),黑龙江东京城镜泊湖源头国家湿地公园(10km),黑龙江绥阳国家湿地公园(10km),黑龙江八五八小穆棱河国家湿地公园(10km),黑龙江绥滨月牙湖国家湿地公园(10km),黑龙江齐齐哈尔江心岛国家湿地公园(10km),黑龙江安达古大湖国家湿地公园(10km),黑龙江通河二龙潭国家湿地公园(10km),黑龙江白桦川国家湿地公园(10km),黑龙江肇岳山国家湿地公园(10km),黑龙江齐齐哈尔明星岛国家湿地公园(10km),黑龙江塔头湖河国家湿地公园(10km),黑龙江塔头湖河国家湿地公园(10km)",,/RuoYi-Vue/coverpic/164.jpg
165,黑龙江省民族博物馆,综合类,黑龙江省哈尔滨市南岗区文庙街25号,0,09:00~16:00,,国家一级（文物）,,,57465,黑龙江省民族博物馆是以哈尔滨文庙为馆舍，成立于1985年。我国第一家省级专业性民族博物馆，以收集、研究和展出我省满族、蒙古族、回族、朝鲜族、赫哲族、鄂伦春族、鄂温克族、达斡尔族、锡伯族、柯尔克孜族为宗旨。黑龙江省民族博物馆（哈尔滨文庙）座落在哈尔滨市南岗区，是在哈尔滨文庙的基础上，经过维修，于1988年正式对外开放。这些民族鱼皮文化、桦皮文化、萨满文化等等，都具有浓郁的民族特色，独特而富有魅力。,,乘坐6路公交车在“哈工程大学”站下车，步行约1.1千米即到。,"哈尔滨文化公园(1km),哈尔滨市哈军工文化园景区(1km),哈尔滨市哈尔滨文庙(1km),哈尔滨文化公园(1km),普照寺（黑龙江省哈尔滨市南岗区）(1km),极乐寺（黑龙江省哈尔滨市）(1km),哈尔滨工程大学(1km),哈尔滨古梨园(2km),哈尔滨市白鱼泡湿地旅游区(2km),东北虎豹国家公园(3km),哈尔滨秋林国际购物中心(3km),哈尔滨远大购物中心(3km),果戈里大街(3km),哈尔滨冰情岛水上乐园(3km),日月峡水伊方水上乐园(3km),黑龙江省龙江剧院(3km),靖宇公园(3km),哈尔滨儿童公园(3km),哈尔滨市中国人民解放军第四野战军前线指挥部旧址(3km),黑龙江大峡谷自然保护区(3km),黑龙江宾县二龙湖国家湿地公园(3km),哈尔滨市老道外中华巴洛克历史文化景区(3km),华严寺（黑龙江省哈尔滨市）(3km),黑龙江伍连德纪念馆(3km),哈尔滨市博物馆(3km),中共黑龙江历史纪念馆(3km),东北烈士纪念馆(3km),青肯泡(4km),中共满洲省委机关旧址纪念馆(4km),哈尔滨东站(4km),哈尔滨音乐厅(4km),苏联红军烈士纪念碑(4km),哈尔滨站(4km),哈尔滨索菲亚广场(4km),黑龙江省歌舞剧院(4km),东北抗联博物馆(4km),哈尔滨冰灯游园会(4km),黑龙江哈尔滨阿勒锦岛国家湿地公园(4km),哈尔滨莫斯科商场旧址(4km),哈尔滨颐园街一号欧式建筑(4km),圣?索菲亚教堂(4km),哈尔滨市南岗区展览馆(4km),哈尔滨市华南城休闲文化旅游区(4km),黑龙江省广播电视塔（龙塔）(4km),黑龙江音乐博物馆(4km),黑龙江邮政博物馆(4km),黑龙江省地质博物馆(4km),中共满洲省委机关旧址纪念馆(4km),革命领袖视察黑龙江纪念馆(4km),哈尔滨市建筑艺术馆(4km),黑龙江省博物馆(4km),哈尔滨建筑艺术馆(5km),哈尔滨俄罗斯商品一条街(5km),哈尔滨金安国际购物广场(5km),哈尔滨松雷国际大厦(5km),哈尔滨万达广场(5km),哈尔滨百盛购物中心(5km),哈尔滨中央书店(5km),哈尔滨市松浦大桥(5km),哈尔滨斯大林公园(5km),尚志大街(5km),哈尔滨儿童乐园(5km),松浦洋行(5km),兆麟公园(5km),哈尔滨中央大街(5km),马迭尔宾馆(5km),哈尔滨市中央欧陆风情旅游区(5km),哈尔滨工业大学博物馆(5km),安重根义士纪念馆(5km),李兆麟将军纪念馆(5km),哈尔滨钱币博物馆(5km),北大荒博物馆(5km),大兴安岭资源馆(5km),香坊火车站(6km),哈尔滨烈士陵园(6km),灵隐寺（黑龙江省哈尔滨市）(6km),人民音乐家郑律成纪念馆(6km),太阳岛笨熊乐园(7km),哈尔滨水上公园(7km),建国公园(7km),太阳岛国际雪雕艺术博览会(7km),黑龙江哈尔滨阿什河国家湿地公园(7km),哈尔滨市中国亭园旅游景区(7km),哈尔滨市松松小镇旅游景区(7km),哈尔滨极地馆(7km),哈尔滨太阳岛风景名胜区(7km),哈尔滨森林植物园(8km),哈尔滨地藏寺(8km),哈尔滨大剧院(8km),月亮湾滑雪场(8km),哈尔滨市东北虎林园(8km),黑龙江省科学技术馆(8km),哈尔滨冰雪大世界(9km),农垦北大荒现代农业园景区(9km),关东古巷美食街(10km),哈尔滨市白鱼泡水利风景区(10km),道台府(10km),黑龙江省现代农业示范区旅游景区(10km),哈尔滨市滨江湿地旅游景区(10km),哈尔滨市永泰世界旅游景区(10km),哈尔滨市永泰世界旅游景区(10km)",,/RuoYi-Vue/coverpic/165.jpg
166,大庆市铁人王进喜纪念馆,历史类,黑龙江省大庆市让胡路区中原路2号,0,08:30~16:00（周一闭馆）,2小时,国家一级（行业）,,4A,57463,铁人王进喜纪念馆，建立于1971年，位于黑龙江省大庆市解放二街，是为了纪念中国工人阶级的先锋战士――铁人王进喜而建立的。纪念馆总占地面积5.4万平方米，其中绿地面积3万平方米，主馆建筑面积1240平方米，展厅总面积4790平方米，展出展品1780件。铁人王进喜纪念馆，先后荣获全国爱国主义教育示范基地、中国石油企业精神教育基地、大庆油田企业精神教育基地、大庆市廉政教育基地等荣誉称号。,,市区内可乘坐公交36路、6路、106路、26路、113路即可到达。,"大庆石油科技馆(3km),大庆市儿童公园(9km),大庆市儿童公园(9km)",,/RuoYi-Vue/coverpic/166.jpg
167,瑷珲历史陈列馆,历史类,黑龙江省黑河市爱辉区萨布素街,0,全天,1~2小时,国家一级（文物）,,4A,57462,黑河市瑷珲历史陈列馆，始建于1975年，位于黑龙江省黑河市爱辉区瑷珲镇，是全国一座以全面反映中俄远东关系史为基本展陈内容的专题性遗址博物馆。陈列馆先后荣获全国百家爱国主义教育示范基地之一、全国重点文物保护单位、国家AAAA级旅游景区、黑龙江省青少年爱国主义教育基地等荣誉称号。瑷珲历史陈列馆，占地8000平方米，展厅面积为200平方米。,,"飞机
黑河机场是中国开展航空运输活动较早的民用机场之一，目前有航班主要通往北京、哈尔滨、上海、三亚等地，均为每日一班。

 火车
前往黑河的五大连池，可从哈尔滨出发，先到北安；如果从齐齐哈尔出发，可乘空调特快列车去北安。抵达北安后，再换乘汽车前往五大连池。

 公路
前往五大连池，取道黑河市，这里以公路为主，连接黑河、北安市及附近各县，有公共汽车和旅游班车往来。","黑河瑷珲国家森林公园(3km),黑河瑷珲国家森林公园(3km)",,/RuoYi-Vue/coverpic/167.jpg
168,东北烈士纪念馆,历史类,黑龙江省哈尔滨市南岗区一曼街241号,0,09:00~16:30,,国家一级（文物）,,,57460,东北烈士纪念馆成立于1948年10月10日，坐落在哈尔滨市南岗区一曼街241号，是中国共产党在大城市建立的第一个规模较大的永久性纪念馆和首批国家一级博物馆、全国爱国主义教育示范基地、全国文物系统先进集体、国家国防教育示范基地、全国廉政文化教育基地、全国红色旅游经典景区。2017年1月，国家发改委、中宣部、财政部、国家旅游局、中央党史研究室等单位公布了《全国红色旅游经典景区名录》，东北烈士纪念馆位列其中。,,乘哈尔滨市公交2路、8路、89路、105路、107路、108路、109路、115路、201路即可到达。,"哈尔滨秋林国际购物中心(1km),哈尔滨远大购物中心(1km),哈尔滨音乐厅(1km),苏联红军烈士纪念碑(1km),黑龙江省龙江剧院(1km),哈尔滨市中国人民解放军第四野战军前线指挥部旧址(1km),东北抗联博物馆(1km),黑龙江大峡谷自然保护区(1km),黑龙江宾县二龙湖国家湿地公园(1km),哈尔滨莫斯科商场旧址(1km),哈尔滨颐园街一号欧式建筑(1km),黑龙江邮政博物馆(1km),黑龙江伍连德纪念馆(1km),哈尔滨市博物馆(1km),革命领袖视察黑龙江纪念馆(1km),中共黑龙江历史纪念馆(1km),黑龙江省博物馆(1km),哈尔滨金安国际购物广场(2km),哈尔滨松雷国际大厦(2km),果戈里大街(2km),尚志大街(2km),哈尔滨冰情岛水上乐园(2km),日月峡水伊方水上乐园(2km),哈尔滨儿童乐园(2km),哈尔滨站(2km),哈尔滨索菲亚广场(2km),黑龙江省歌舞剧院(2km),哈尔滨儿童公园(2km),哈尔滨冰灯游园会(2km),马迭尔宾馆(2km),圣?索菲亚教堂(2km),哈尔滨市老道外中华巴洛克历史文化景区(2km),哈尔滨市南岗区展览馆(2km),华严寺（黑龙江省哈尔滨市）(2km),黑龙江音乐博物馆(2km),安重根义士纪念馆(2km),李兆麟将军纪念馆(2km),哈尔滨钱币博物馆(2km),哈尔滨市建筑艺术馆(2km),哈尔滨建筑艺术馆(3km),哈尔滨俄罗斯商品一条街(3km),哈尔滨万达广场(3km),哈尔滨百盛购物中心(3km),哈尔滨中央书店(3km),中共满洲省委机关旧址纪念馆(3km),哈尔滨斯大林公园(3km),松浦洋行(3km),哈尔滨文化公园(3km),兆麟公园(3km),哈尔滨中央大街(3km),哈尔滨市哈军工文化园景区(3km),哈尔滨市哈尔滨文庙(3km),哈尔滨市中央欧陆风情旅游区(3km),哈尔滨文化公园(3km),普照寺（黑龙江省哈尔滨市南岗区）(3km),极乐寺（黑龙江省哈尔滨市）(3km),灵隐寺（黑龙江省哈尔滨市）(3km),哈尔滨工业大学博物馆(3km),人民音乐家郑律成纪念馆(3km),中共满洲省委机关旧址纪念馆(3km),黑龙江省民族博物馆(3km),青肯泡(4km),哈军工纪念馆(4km),靖宇公园(4km),建国公园(4km),黑龙江哈尔滨阿勒锦岛国家湿地公园(4km),哈尔滨市白鱼泡湿地旅游区(4km),黑龙江省广播电视塔（龙塔）(4km),哈尔滨工程大学(4km),太阳岛笨熊乐园(5km),哈尔滨水上公园(5km),哈尔滨古梨园(5km),哈尔滨烈士陵园(5km),哈尔滨地藏寺(5km),太阳岛国际雪雕艺术博览会(5km),哈尔滨极地馆(5km),黑龙江省地质博物馆(5km),哈尔滨太阳岛风景名胜区(5km),哈尔滨东站(6km),哈尔滨市松浦大桥(6km),香坊火车站(6km),月亮湾滑雪场(6km),哈尔滨市松松小镇旅游景区(6km),哈尔滨市华南城休闲文化旅游区(6km),黑龙江省科学技术馆(6km),北大荒博物馆(6km),大兴安岭资源馆(6km),哈尔滨森林植物园(7km),哈尔滨冰雪大世界(7km),哈尔滨大剧院(7km),哈尔滨市东北虎林园(7km),关东古巷美食街(8km),哈尔滨市中国亭园旅游景区(8km),哈尔滨西站(9km),哈尔滨雨阳公园(9km),群力国家城市湿地公园(9km),黑龙江哈尔滨阿什河国家湿地公园(9km),哈尔滨北大荒有机草莓园(10km),狗岛(10km),哈尔滨麦凯乐(10km),哈尔滨新一百(10km),黑天鹅度假村(10km),哈尔滨毛泽东视察纪念馆(10km),阳明滩大桥(10km),哈尔滨刘少奇革命活动旧址(10km),美丽岛温泉水乐园(10km),呼兰河口湿地水世界(10km),防洪纪念塔(10km),圣・尼古拉大教堂(10km),大秃顶子山(10km),哈尔滨松花江铁路大桥(10km),哈尔滨莫斯科大剧院(10km),哈尔滨莫斯科大剧院(10km)",,/RuoYi-Vue/coverpic/168.jpg
169,黑龙江省博物馆,综合类,黑龙江省哈尔滨市南岗区红军街50号,0,09:00~17:00,,国家一级（文物）,,3A,57459,黑龙江省博物馆位于哈尔滨市南岗区，始建于1906年，主楼是一座欧洲巴洛克式建筑，为原俄罗斯商场旧址，为国家一级保护建筑。新中国成立后，黑龙江省博物馆成为全国首批集历史文物、自然标本、艺术品为一体的省级综合类公益性博物馆，承担着黑龙江省历史文物、革命文物、民族文物和自然标本的保护、发掘、征集、采集以及研究、陈列等工作。1999年，《黑龙江历史文物陈列》展厅被评为省十大陈列精品奖。,,可乘2、7、8、11、13、14、16、18、21、28、31、32、33、55、63、64、74、81、92、94、101、103、107、108、109、110、115、120到博物馆站或省博览中心站或建设街站下车。,"哈尔滨秋林国际购物中心(1km),哈尔滨远大购物中心(1km),果戈里大街(1km),苏联红军烈士纪念碑(1km),哈尔滨站(1km),黑龙江省龙江剧院(1km),东北抗联博物馆(1km),哈尔滨莫斯科商场旧址(1km),哈尔滨颐园街一号欧式建筑(1km),哈尔滨市南岗区展览馆(1km),黑龙江音乐博物馆(1km),黑龙江邮政博物馆(1km),哈尔滨市博物馆(1km),革命领袖视察黑龙江纪念馆(1km),中共黑龙江历史纪念馆(1km),东北烈士纪念馆(1km),中共满洲省委机关旧址纪念馆(2km),哈尔滨音乐厅(2km),哈尔滨冰情岛水上乐园(2km),日月峡水伊方水上乐园(2km),哈尔滨索菲亚广场(2km),哈尔滨儿童公园(2km),哈尔滨市中国人民解放军第四野战军前线指挥部旧址(2km),黑龙江大峡谷自然保护区(2km),黑龙江宾县二龙湖国家湿地公园(2km),圣?索菲亚教堂(2km),华严寺（黑龙江省哈尔滨市）(2km),黑龙江伍连德纪念馆(2km),哈尔滨工业大学博物馆(2km),安重根义士纪念馆(2km),中共满洲省委机关旧址纪念馆(2km),哈尔滨市建筑艺术馆(2km),青肯泡(3km),哈尔滨建筑艺术馆(3km),哈尔滨俄罗斯商品一条街(3km),哈尔滨金安国际购物广场(3km),哈尔滨松雷国际大厦(3km),哈尔滨中央书店(3km),尚志大街(3km),哈尔滨儿童乐园(3km),松浦洋行(3km),黑龙江省歌舞剧院(3km),兆麟公园(3km),哈尔滨冰灯游园会(3km),哈尔滨中央大街(3km),马迭尔宾馆(3km),哈尔滨市老道外中华巴洛克历史文化景区(3km),哈尔滨市中央欧陆风情旅游区(3km),极乐寺（黑龙江省哈尔滨市）(3km),灵隐寺（黑龙江省哈尔滨市）(3km),李兆麟将军纪念馆(3km),哈尔滨钱币博物馆(3km),哈尔滨万达广场(4km),哈尔滨百盛购物中心(4km),哈军工纪念馆(4km),哈尔滨斯大林公园(4km),哈尔滨水上公园(4km),哈尔滨文化公园(4km),建国公园(4km),哈尔滨烈士陵园(4km),黑龙江哈尔滨阿勒锦岛国家湿地公园(4km),哈尔滨市哈军工文化园景区(4km),哈尔滨市哈尔滨文庙(4km),哈尔滨文化公园(4km),黑龙江省广播电视塔（龙塔）(4km),普照寺（黑龙江省哈尔滨市南岗区）(4km),人民音乐家郑律成纪念馆(4km),黑龙江省民族博物馆(4km),哈尔滨工程大学(4km),哈尔滨古梨园(5km),靖宇公园(5km),哈尔滨地藏寺(5km),哈尔滨市松松小镇旅游景区(5km),哈尔滨市白鱼泡湿地旅游区(5km),黑龙江省地质博物馆(5km),北大荒博物馆(5km),大兴安岭资源馆(5km),哈尔滨太阳岛风景名胜区(5km),哈尔滨市松浦大桥(6km),香坊火车站(6km),太阳岛笨熊乐园(6km),哈尔滨森林植物园(6km),太阳岛国际雪雕艺术博览会(6km),月亮湾滑雪场(6km),哈尔滨市华南城休闲文化旅游区(6km),哈尔滨极地馆(6km),黑龙江省科学技术馆(6km),哈尔滨东站(7km),关东古巷美食街(7km),哈尔滨冰雪大世界(7km),哈尔滨市中国亭园旅游景区(7km),哈尔滨西站(8km),群力国家城市湿地公园(8km),哈尔滨大剧院(8km),哈尔滨市东北虎林园(8km),哈尔滨雨阳公园(9km),哈尔滨北大荒有机草莓园(10km),狗岛(10km),哈尔滨麦凯乐(10km),哈尔滨新一百(10km),黑天鹅度假村(10km),哈尔滨毛泽东视察纪念馆(10km),阳明滩大桥(10km),哈尔滨刘少奇革命活动旧址(10km),美丽岛温泉水乐园(10km),呼兰河口湿地水世界(10km),防洪纪念塔(10km),圣・尼古拉大教堂(10km),大秃顶子山(10km),哈尔滨松花江铁路大桥(10km),哈尔滨莫斯科大剧院(10km),黑龙江哈尔滨阿什河国家湿地公园(10km),农垦北大荒现代农业园景区(10km),农垦北大荒现代农业园景区(10km)",,/RuoYi-Vue/coverpic/169.jpg
