id ,name ,type ,address ,TicketPrice ,OpeningHours ,Suggestedtraveltime,Suggestedtraveltime,units,attractionlevel,number,introduction,Scenery,Howtogo,Scenicspotsaround,,cover
42,汉阳陵博物馆,综合类,陕西省西安市未央区经济技术开发区泾河工业园机场路,70,08:30~18:30,全天,国家一级（文物）,,4A,60636,汉阳陵博物馆，国家AAAA级旅游景区，位于陕西省西安市北郊的渭河之畔，是全国重点文物保护单位。汉阳陵主要由帝陵陵园、后陵陵园、南区从葬坑、北区从葬坑、礼制建筑、陪葬墓园、刑徒墓地以及阳陵邑等部分组成。汉阳陵博物馆，依托西汉景帝与王皇后同茔异穴合葬的阳陵陵园而建，是一座巧妙融合现代科技与古代文明、历史文化与园林景观于一体的大型文化旅游景区。,,"公交车：

1、游4乘车线路：西安市图书馆→汉阳陵博物馆；发车时间：8:30、10:20、12:00、13:40、15:20、17:00；返程：9:30、11:10、12:50、14:30、16:10、18:00。

2、咸阳5路公交车：咸阳火车站→汉阳陵博物馆

3、西安市地铁二号线至市图书馆站D出口，转乘游4抵达汉阳陵博物馆。

自驾车：

1、从西安市区出发，可以沿朱宏路直行至新建的机场专用高速公路。在新建的机场专用高速公路上有“汉阳陵”标识牌引导，一路可轻松便捷抵达汉阳陵。走新开通的机场专用高速公路到汉阳陵只需缴费5元。

2、从省外到陕西的游客，可以从西安绕城高速公路“朱宏路”出口进入新建的机场专用高速公路。在新建的机场专用高速公路上有“汉阳陵”标识牌引导，一路可轻松便捷抵达汉阳陵。","乐华城88℃温泉水上乐园(4km),西安乐华欢乐世界(5km),未央湖游乐园(6km),西安哄惫家湿地公园(6km),泾阳崇文塔景区(6km),灞渭车游湿地景区(7km),西安渭河生态水利风景区(7km),西安北站(8km),秦咸阳城遗址(9km),泾河新城茯茶镇(10km),西安高陵奇石博物馆(10km),西安高陵奇石博物馆(10km)",,/RuoYi-Vue/coverpic/42.jpg
43,西安碑林博物馆,艺术类,陕西省西安市碑林区三学街15号,50,08:00~17:30,2小时,国家一级（文物）,,,60635,西安碑林博物馆是陕西创建最早的博物馆，它以收藏、陈列和研究历代碑刻、墓志及石刻为主，成为在中国独树一帜的艺术博物馆。现有馆藏文物11000余件，其中国宝级文物19个号134件，一级文物535件。著名的“昭陵六骏”就有四骏藏于本馆。陈列由碑林、石刻艺术和其它文物展览三部分组成，共12个展室。现有7座碑室、8座碑廊、8座碑亭，加上石刻艺术室和4座文物陈列，陈列面积达到4900平米。,,"公交车

可乘坐14路、23路、40路118路、208路、214路、221路、223路、232路、706路、402路、512路、619路、704路、800路、游6路、258路公交车到达。","西安城墙-碑林历史文化景区(1km),书院门(1km),开元商城(1km),西安市群众艺术馆(1km),西安钟鼓楼广场(1km),顺城巷(1km),易俗社剧场(1km),西安碑林(1km),西安城墙景区(1km),卧龙禅寺（陕西省西安市）(1km),清河(2km),西安环城公园(2km),西安人民大厦(2km),西安人民剧院(2km),西安高家大院(2km),西安回民街(2km),大学习巷清真寺(2km),西安城隍庙(2km),西安清真寺(2km),西安事变旧址(2km),小雁塔(2km),西安市高家大院古典服饰博物馆(2km),陕西科学技术馆(2km),西安市钟鼓楼博物馆(2km),西安唐皇城墙含光门遗址博物馆(2km),西安事变纪念馆(2km),西安博物院(2km),止园(3km),西安革命公园(3km),陕西省艺术馆(3km),国瑞・西安金融中心(3km),陂湖(3km),陕西省西安汽车站(3km),西安站(3km),陕西省图书馆(3km),西安儿童公园(3km),唐大慈恩寺遗址公园(3km),兴庆宫公园(3km),西安雁鸣湖湿地公园(3km),永兴坊(3km),八路军西安办事处旧址(3km),西安市万寿八仙宫(3km),罔极寺(3km),西安建筑科技大学校史馆（贾平凹文学艺术馆）(3km),西安中国书法艺术博物馆(3km),八路军西安办事处纪念馆(3km),西安交通大学(3km),西安歌舞剧院(4km),兴庆宫(4km),明秦王墓(4km),大禹庙景区(4km),西安大汉上林苑（杜陵）生态景区(4km),广仁寺（陕西省西安市）(4km),西安大兴善寺(4km),长安大学地质博物馆(4km),西北大学博物馆(4km),陕西历史博物馆(4km),长乐公园(5km),大唐不夜城(5km),中国唐苑(5km),陕西广电大剧院(5km),圜丘遗址(5km),杜陵(5km),大雁塔(5km),大明宫国家遗址公园(5km),西安大唐西市文化景区(5km),曲江海洋极地公园(5km),青龙寺（陕西省西安市）(5km),大慈恩寺(5km),西安市雅观陶瓷艺术博物馆(5km),长安古钱币博物馆(5km),陕西唐三彩艺术博物馆(5km),陕西万达博物院(5km),西安大唐西市博物馆(5km),西安牡丹苑(6km),西安烈士陵园(6km),丰庆公园(6km),陕西大剧院(6km),长安圣寿寺塔(6km),西安钟鼓楼(6km),钟鼓楼(6km),西安曲江艺术博物馆(6km),陕西钱币博物馆(6km),陕西西安大雁塔・大唐芙蓉园景区(6km),曲江池遗址公园(7km),丝绸群雕(7km),西安电视塔(7km),西安城北客运站(7km),西安东站（原西安东站）(7km),西安幻太奇海洋馆(7km),曲江遗址公园(7km),汉城湖公园(7km),曲江乐园(7km),西安石羊农庄生态休闲观光园(7km),西安柴窑文化博物馆(7km),西安源浩华藏博物馆(7km),陕西汉唐石刻博物馆(7km),陕西自然博物馆(7km),昆明池(8km),西安城西客运站(8km),曲江寒窑遗址公园(8km),西安汉城湖景区(8km),曲江秦二世陵遗址公园景区(8km),西安毛泽东敬览馆(8km),西安植物园(9km),鱼化寨遗址(9km),大明宫遗址(9km),汉长安城遗址(9km),高桂滋公馆(10km),西安绿地中心(10km),姜寨遗址(10km),半坡遗址(10km),西安桃花潭景区(10km),西安曲江富陶国际陶艺博物馆(10km),陕西体育博物馆(10km),汉长安城遗址长乐宫四、五号遗址陈列馆(10km),西安半坡博物馆(10km),西安半坡博物馆(10km)",,/RuoYi-Vue/coverpic/43.jpg
44,西藏博物馆,艺术类,西藏自治区拉萨市城关区罗布林卡路19号,0,10:00~17:30（周一闭馆）,2~3小时,国家一级（文物）,,4A,60625,西藏博物馆，坐落于拉萨市罗布林卡路东南角，是国家AAAA级景区，也是西藏自治区一座具有现代化功能的博物馆。博物馆占地面积53959平方米，总建筑面积23508平方米，展厅面积10451平方米，馆区中轴线上依次坐落着序言厅、主展馆和文物库房。西藏博物馆具有鲜明的藏族传统建筑艺术特点，同时又深刻体现了现代建筑的实用特点和艺术神韵。,,"公交线路：

1、西藏博物馆站：2路、8路、13路、24路。

2、西郊客运站：14路。","罗布林卡(1km),亚东沟(2km),布达拉宫广场(2km),西藏拉萨净土健康动物保护园(2km),拉鲁湿地自然保护区(2km),中央人民政府驻藏代表办公处旧址(2km),宗角禄康公园(3km),门孜康(3km),娘热民俗风情园(3km),扎叶巴寺(3km),拉萨布达拉宫景区(3km),川藏公路(4km),大昭寺广场(4km),拉萨八廓街(4km),邦达仓(4km),小昭寺(4km),西藏牦牛博物馆(4km),大昭寺(4km),西藏金星游乐园(5km),拉萨滨河公园(6km),哲蚌寺（西藏自治区山南市）(6km),色拉寺（西藏自治区拉萨市）(6km),色拉寺分寺扎基寺(6km),喜德寺(7km),德宗温泉(7km),青藏公路(9km),青藏公路(9km)",,/RuoYi-Vue/coverpic/44.jpg
45,云南民族博物馆,艺术类,云南省昆明市西山区滇池路1503号,0,09:00~16:30,,国家一级（行业）,,,60521,云南民族博物馆与滇池边的云南民族村相邻，距昆明市区约9公里。这时云南各少数民族历史文化最集中的收藏于展示场所，也是东南亚最大的民族博物馆。这里展出的各类展品达万余件，分《云南少数民族社会形态DD改革与发展》、《云南少数民族生态产业》、《云南少数民族纺织工艺和服饰艺术》、《云南少数民族民间美术》、《云南少数民族节庆乐舞》、《云南少数民族手工艺品》、《云南少数民族古籍文献》和《奇石珍宝》等8个专题，在16个展厅里展出，有很高的学术研究价值和观赏价值。,,云南民族博物馆与滇池边的云南民族村相邻，距昆明市区约9公里。,"海埂公园(1km),中国兵器房车温泉度假中心(1km),云南民族村(1km),大自然风情园(2km),海埂公园水乐园(2km),昆明滇池春天温泉会馆(2km),昆明滇池风景名胜区(2km),公园1903(3km),昆明三清阁(4km),周培源旧居(4km),昆明龙门石窟(4km),福保文化城温泉水上世界(4km),聂耳墓(4km),太华寺（云南省昆明市）(4km),南洋华侨机工抗日纪念碑(5km),草海(5km),华亭寺（云南省昆明市）(5km),杨升庵纪念馆(5km),七彩云南・欢乐世界(6km),昆明市西山森林公园(6km),宝华寺（云南省昆明市）(6km),滇池国际会展中心(7km),昆明西山万达广场(7km),大观楼(7km),昆明市大观公园(7km),西山蝴蝶园(8km),昆明市西山区文化馆(8km),昆明站(8km),妙湛寺（云南省昆明市）(8km),昆都（夜市）(9km),昆明金碧公园(9km),东西寺塔(9km),祥云街(9km),云南艺术剧院(9km),云南金刚塔(9km),忠爱坊(9km),金马碧鸡坊(9km),昆明巫家坝国际机场(9km),昆明世界蝴蝶生态园(9km),惠光寺塔和常乐寺塔(9km),云南人家(9km),昆明官渡古镇(9km),法定寺(9km),云南茶文化博物馆(9km),官渡区博物馆(9km),云南省博物馆(9km),小湾水库(10km),云南人民英雄纪念碑(10km),石屏会馆(10km),昆明东风广场(10km),云南大剧院(10km),昆明市文化馆(10km),昆明飞虎队纪念馆(10km),大德寺双塔(10km),昆明创库(10km),1903梦幻联邦乐园(10km),翠湖(10km),海巢海洋馆(10km),云南大理国经幢(10km),昆明翠湖公园(10km),抗战胜利纪念堂(10km),真庆观古建筑群(10km),云南陆军讲武堂旧址(10km),福林堂(10km),清水海水库(10km),云龙水库(10km),昆明市翠湖.讲武堂景区(10km),昆明星耀・水乡旅游度假区(10km),昆明经典假日谷(10km),真庆观(10km),云师大“一二・一”纪念馆(10km),云南陆军讲武堂历史博物馆(10km),昆明市博物馆(10km),昆明市博物馆(10km)",,/RuoYi-Vue/coverpic/45.jpg
46,云南省博物馆,综合类,云南省昆明市官渡区广福路6393号,0,08:00~17:30,3-4小时,国家一级（文物）,,,60520,云南省博物馆是一座综合性的博物馆，创建于1951年。馆内现有以下9个部门，分别是：担负藏品收藏与保护的保管部；承担向社会公众介绍宣传博物馆展览的社会教育部；主管文物鉴定和文物征集的鉴定站；编辑出版馆刊《云南文物》及收藏各类书刊和信息资料等等。2007年6月，云南省博物馆被国家文物局授予“全国文化遗产保护工作先进集体”称号；2007年，云南省博物馆还被国家文物局列为“全国十五家重点博物馆”之一；2008年5月18日开始，云南省博物馆对外永久性免费开放，现为国家一级博物馆。,,"公交：
官渡区政府站：169路、252路、a12路
地铁：
星耀路站：地铁1号线 下车后步行至子君村(彩云北路)站并搭乘z84路，在广福路口(古渡口路)站下车","云南金刚塔(1km),昆明官渡古镇(1km),法定寺(1km),昆明螺蛳湾国际商贸城(3km),宝华寺（云南省昆明市）(4km),云南紫云青鸟国际珠宝文化旅游区(5km),妙湛寺（云南省昆明市）(5km),滇池国际会展中心(6km),昆明巫家坝国际机场(6km),晨农农博园(7km),福保文化城温泉水上世界(7km),昆明花都海洋世界(7km),云南人家(7km),官渡区博物馆(7km),大自然风情园(8km),昆明西山万达广场(8km),石龙坝水电站(8km),公园1903(9km),海埂大坝(9km),昆明站(9km),云南民族博物馆(9km),东西寺塔(10km),海埂公园水乐园(10km),七彩云南・欢乐世界(10km),洛龙公园(10km),海埂公园(10km),真庆观古建筑群(10km),惠光寺塔和常乐寺塔(10km),昆明滇池春天温泉会馆(10km),中国兵器房车温泉度假中心(10km),云南民族村(10km),真庆观(10km),昆明市博物馆(10km),昆明滇池风景名胜区(10km),昆明滇池风景名胜区(10km)",,/RuoYi-Vue/coverpic/46.jpg
47,贵州民族博物馆,综合类,贵州省遵义市红花岗区子尹路96号,0,08:30~17:00,,国家一级（文物）,国家第一批(1935年),,60436,贵州省民族博物馆，隶属于贵州省民族宗教事务委员会，是县处级公益性事业单位，总占地面积13175平方米，是在2007年建成的贵州民族文化宫大楼的基础上，于2012年正式挂牌成立的全国第五个省级民族博物馆。2011年，贵州省民族博物馆被国家民委命名为“全国民族团结进步教育基地”，2013年被国家文物局评定为国家二级博物馆，是贵阳市中小学教育实践基地，贵州民族大学教学实践基地，贵州师范大学民族文化教育实践基地。2020年，贵州省民族博物馆入选“第四批国家一级博物馆名单”。,,"公交乘车信息：

1、乘坐11、16、21、306、309、30、310、38、4、50、6路公交车到箭道街路口站下，步行30米到博物馆。

2、乘坐50、61、62路公交车到兴关路口站下车，步行67米到博物馆。

3、乘坐18、237、26、303、310、31、34、37、42、63、66、67、68、8、9路公交车到纪念塔站下，向筑城广场方向步行500米。

4、乘坐15、17、1、20、219、23、24、253、29、2、30、44、65路公交车到新路口站下，步行200米到博物馆。
","红军四渡赤水战役旧址(1km),贵州凤凰山国家森林公园(1km),遵义市红花岗遵义会议会址旅游景区(1km),遵义海洋馆(2km),湘山寺（贵州省遵义市）(2km),遵义市遵义动物园(3km),遵义市博物馆(4km),遵义市思达?遵义乐园旅游景区(6km),杨粲墓(8km),遵义市播州乡韵庄园(9km),遵义市汇川国际温泉旅游城(10km),遵义市汇川国际温泉旅游城(10km)",,/RuoYi-Vue/coverpic/47.jpg
48,贵州省博物馆,综合类,贵州省贵阳市云岩区北京路168号,0,09:00~17:00,3小时,国家一级（文物）,,,60437,"贵州省博物馆是中国省级综合性博物馆,位于贵阳市林城东路。1953年筹建,1958年开馆。占地面积106.29亩，总建筑面积46450平方米。该馆馆藏文物、标本20余万件。民族文物是该馆重点藏品之一，除刺绣、蜡染、挑花、织锦、银饰等1000余件。典型藏品有苗族婚姻记事符木、苗族刻绘动物图案酒角、苗族青缎镶花边饰银铃银坠女夹衣，彝族土司八卦龙袍、彝文《六祖纪略》手抄本和水族墓葬石刻“铜鼓”。",,"公交站：

贵阳警备区(48路; 58路; 208路; 209路; 218路; 263路; 281路; 夜间8路)

国际会议中心（北）(48路; 58路; 208路; 209路; 218路; 263路; 281路)","弘福寺（贵州省贵阳市）(1km),贵阳南国花锦购物中心(2km),八路军贵阳办事处旧址(2km),贵阳黔灵山动物园(2km),云岩黔灵山公园旅游景区(2km),觉园尼庵(2km),贵州师范大学(2km),贵阳翠微园(3km),贵阳文昌阁(3km),贵阳中大国际广场(3km),贵阳东山公园(3km),贵州科技馆(3km),贵州凯宾斯基酒店(3km),筑城广场(3km),文昌阁和甲秀楼(3km),贵阳市甲秀楼景区(3km),贵阳市河滨公园(3km),黔明寺(3km),贵州省民族博物馆(3km),二七路小吃街(4km),贵阳世界贸易中心(4km),贵阳国际金融中心(4km),仙人洞道观(4km),贵阳北站(5km),贵阳花果园双子塔东塔(6km),贵阳市乌当保利国际温泉(6km),贵阳药用植物园(7km),贵阳森林公园(7km),南郊公园(7km),天邑森林温泉(7km),贵阳市南明阿哈湖湿地公园景区(7km),贵阳万科广场(8km),贵州长坡岭国家森林公园(8km),贵阳市乌当贵御温泉旅游景区(8km),中天・未来方舟(9km),观山湖公园(9km),泉天下国际俱乐部(9km),贵阳市天鹅湖景区(9km),贵阳市森林公园(9km),贵阳北京路站网红街(10km),贵阳喀斯特公园(10km),贵州苏格兰牧场(10km),贵阳奥林匹克体育中心(10km),贵阳电视塔(10km),东林寺（贵州省贵阳市）(10km),东林寺（贵州省贵阳市）(10km)",,/RuoYi-Vue/coverpic/48.jpg
49,遵义会议博物馆,历史类,贵州省遵义市红花岗区子尹路96号,0,08:30~17:00,,国家一级（文物）,国家第一批(1935年),,60436,遵义会议纪念馆是为纪念中国共产党历史上具有伟大历史意义的遵义会议而建立的，是中华人民共和国成立后最早建立的21个革命纪念馆之一。位于贵州省遵义市子尹路96号，1955年10月开放。1961年3月，国务院公布遵义会议会址为全国第一批重点文物保护单位；1964年底，毛泽东主席为纪念馆手书“遵义会议会址”六个大字。2008年5月16日，列入国家文物局首批国家一级博物馆。2017年1月，国家发改委网站公布《全国红色旅游经典景区名录》，遵义会议纪念馆入选中国红色旅游经典景区名录。,,交通线路：遵义会议会址公交站途径公交车：2路内环、2路外环、2路循环线、4路、6路环线、6路循环线、7路、9路、18路、21路、25路。,"红军四渡赤水战役旧址(1km),贵州凤凰山国家森林公园(1km),遵义市红花岗遵义会议会址旅游景区(1km),遵义海洋馆(2km),湘山寺（贵州省遵义市）(2km),遵义市遵义动物园(3km),遵义市博物馆(4km),遵义市思达?遵义乐园旅游景区(6km),杨粲墓(8km),遵义市播州乡韵庄园(9km),遵义市汇川国际温泉旅游城(10km),遵义市汇川国际温泉旅游城(10km)",,/RuoYi-Vue/coverpic/49.jpg
50,5・12汶川特大地震纪念馆,自然科学类,四川省绵阳市北川羌族自治县曲山镇任家坪,0,,,国家一级（文物）,,,60292,“5・12”汶川特大地震纪念馆按照“自然、简朴、生态、科学”八字方针，由上海同济大学建筑设计研究院设计。纪念馆占地14.23万平方米，建筑面积14280平方米，陈展面积10748平方米。主体建筑名为“裂缝”，寓意 “将灾难时刻闪电般定格在大地之间，留给后人永恒的记忆”。整个建筑造型以大地景观的手法，通过地面切割、抬起，形成主要的建筑体量，并通过下沉广场和步道向外延伸，与平缓的草坡融为一体，局部翘起露出地面，寓意新生和希望。,,"自驾：
成都（昭觉寺收费站）――成绵高速――绵阳南（磨家收费站）――出高速收费站左转直行3公里左右再左转――辽宁大道――新北川羌城旅游区游客中心。",绵阳市北川羌城旅游区(1km),,/RuoYi-Vue/coverpic/50.jpg
51,四川省建川博物馆,历史类,四川省成都市大邑县安仁镇迎宾路,60,09:00~17:30,1~2小时,国家一级（非国有）,,4A,60241,建川博物馆，位于四川省成都市大邑县安仁古镇。博物馆占地500亩，建筑面积近10万平方米，拥有藏品800余万件，其中国家一级文物404件。建川博物馆，以“为了和平，收藏战争；为了未来，收藏教训；为了安宁，收藏灾难；为了传承，收藏民俗”为主题，建设抗战、民俗、红色年代、抗震救灾四大系列30余座分馆，已建成开放24座场馆，是目前国内民间资本投入较多、建设规模和展览面积较大，收藏内容较丰富的民间博物馆。,,"公交:

成都茶店子汽车站/成都石羊场汽车站 直达汽车 → 安仁车站换乘211公交到建川博物馆。

高铁：

从成都西站坐高铁到大邑县再换乘211公交到建川博物馆站。

自驾：

1、成温邛高速路经温江、崇州行至安仁古镇出口下，沿连接线前行10公里既达安仁古镇。

2、成都上三环路草金立交出城，沿永康路上成温邛快速路行驶30分钟既达安仁古镇。","5・12抗震救灾纪念馆(1km),大邑县刘氏庄园博物馆(1km),安仁古镇(2km),安仁古镇(2km)",,/RuoYi-Vue/coverpic/51.jpg
52,朱德故居纪念馆,历史类,四川省南充市仪陇县马鞍镇大弯路47号,0,,,国家一级（文物）,1988年1月国家第三批(1895-1907年),5A,60224,朱德同志故居纪念馆是1988年1月国务院公布的第三批全国重点文物保护单位，位于四川省南充市仪陇县马鞍镇琳琅村朱家大湾，是朱德故里景区的组成部分。1982年8月为纪念中国人民伟大的无产阶级革命家和军事家朱德而建立。为了表达人民对朱德同志的无限崇敬之情，2005年，按照胡锦涛总书记“一定要把朱德故居保护好、一定要把朱德故里建设好”的重要指示进行了改扩建。大门正上方悬挂的是邓小平同志亲笔题写的“朱德同志故居纪念馆”馆名。,,仪陇县城―马鞍（51千米）,"四川省南充市仪陇朱德故里景区(3km),四川省南充市仪陇朱德故里景区(3km)",,/RuoYi-Vue/coverpic/52.jpg
53,自贡市盐业历史博物馆,历史类,四川省自贡市自流井区解放路107号,18,08:30~17:30,1-2小时,国家一级（文物）,,2001年(3A),60220,自贡市盐业历史博物馆位于四川省自贡市中心，建于1959年，是中国博物馆发展历史上最早建立的专业博物馆之一，目前仍是中国唯一的盐业史博物馆。2017年5月18日，晋级第三批国家一级博物馆授牌。这是一座由陕籍盐商集资修筑的同乡会馆，融明清两代宫廷和民间建筑风格于一体。保存完好的碑文、木雕、石刻、泥塑，是研究鸦片战争前清代社会生活、经济状况、宗教艺术的实物标本。1976年4月，该馆创办了馆刊《井盐史通讯》，内部发行，不定期出版。到1985年底，共出刊14期。,,"公交路线：在自贡火车站乘34路到海湾站；在自贡公交客运总站乘市区旅游专线到四医院站、乘1路到十字口站、乘10路到四医院站、33路到沙湾站均可到达目的地。

自驾路线：经由自贡市内丹桂大街，左转进入汇东路，右转进入自由路，再右转进入解放路。左转进入滨江路，再次左转，从滨江路到解放路，沿解放路行驶即可到达。","西秦会馆(1km),中国彩灯博物馆(1km),四川省自贡市文化馆(2km),龊＞(4km),自贡世界地质公园(8km),自贡恐龙博物馆(8km),东源井古盐场(9km),自贡市艾叶古镇(9km),四川西充青龙湖国家湿地公园(10km),四川西充青龙湖国家湿地公园(10km)",,/RuoYi-Vue/coverpic/53.jpg
54,四川广汉三星堆博物馆,历史类,四川省德阳市广汉市西安路133号,82,08:30~17:00,2小时,国家一级（文物）,,2001年(4A),60219,三星堆博物馆，位于四川省德阳市广汉市向新路133号，是迄今在西南地区发现的范围较大、延续时间较长、文化内涵较丰富的古城、古国、古蜀文化遗址。博物馆占地面积约33公顷，绿化面积达80％以上，馆区内环境优美、布局动静得宜，曲径敞道，垂柳依依、古蜀奇葩、湖光岛影无处不体现了人文与自然完美结合、飘逸自然、浑然天成的川西园林特色。,,"1、自驾车：

108国道（至广汉）、成绵高速（至广汉）。

2、高铁：

可乘坐成绵乐城际列车，到广汉北站，乘坐1路公交车，在浏阳名苑换乘10路公交车，到三星堆博物馆站。

3、景区直通车：

在成都景区直通车武侯祠服务点（每天11:30发车）或大熊猫繁殖研究基地服务点（每天12:30发车）乘坐，一站直达无障碍往返。

4、成都市区内乘坐1、7、45、63、69、70、71、83、302路公交车至昭觉寺车站（咨询电话028-83504125），换车至广汉仅需要20分钟，广汉至三星堆乘坐6路、10路公交车即可达到。","四川省广汉市文化馆(7km),雒城遗址(7km),雒城遗址(7km)",,/RuoYi-Vue/coverpic/54.jpg
55,广安邓小平故居陈列馆,历史类,四川省广安市广安区协兴镇,0,08:30~18:00,,国家一级（文物）,,,60218,2004年8月13日邓小平故居陈列馆于四川省广安市广安区协兴镇牌坊村开馆。中央军委主席江泽民为陈列馆题写了馆名。邓小平故居陈列馆位于邓小平故居旁，是国内唯一一家以纪念邓小平为专题的博物馆。陈列馆以“我是中国人民的儿子”为主题，全景式地展现了邓小平和中国共产党人为国家富强、人民幸福而不懈奋斗的光辉历程。广安市邓小平故里旅游区先后被命名为国家AAAAA级旅游景区、国家一级园林、国家一级博物馆、全国红色旅游经典景区、全国重点文物保护单位、全国青少年教育基地、全国廉政教育基地。,,乘8路公共汽车到邓小平故居站,"广安市邓小平故里旅游区(1km),广安北辰湖公园(4km),四川省广安市文化馆(7km),广安市神龙山巴人石头城景区(8km),广安市神龙山巴人石头城景区(8km)",,/RuoYi-Vue/coverpic/55.jpg
