id ,name ,type ,address ,TicketPrice ,OpeningHours ,Suggestedtraveltime,Suggestedtraveltime,units,attractionlevel,number,introduction,Scenery,Howtogo,Scenicspotsaround,,cover
101,青岛山炮台遗址展览馆,历史类,山东省青岛市市南区京山路26号,0,08:30~16:30,,国家一级（文物）,,,58866,1891年，青岛设置后，清军即在此山修筑炮台。此后，几易其主。1997年青岛市政府投资修复“德军要塞地下指挥部”，并在山下建有全面反映青岛百年历史的炮台遗址展览馆。经过几年来的发展建设，现已成为国家3a级旅游景点、国家级重点文物保护单位，山东省爱国主义教育基地、国防教育基地，是一处寓教于游的新的人文景观。从建筑布局上，分为作战指挥、生活卫生、后勤保障三个区域。内部还建有发电机房、锅炉房、水泵房、会议室、兵器室、机要室、官兵餐厅、卫生室、洗澡间、警卫兵室、勤务兵室、秘密逃生孔道等。,,山东省青岛市京山路26号甲,"青岛欢动世界(1km),青岛动物园(1km),青岛中山公园(1km),洪深故居(1km),红岛站(1km),青岛山炮台教育基地(1km),青岛电视塔（青岛旅游观光塔）(1km),青岛葡萄酒博物馆(1km),青岛琅琊台博物馆(1km),青岛第一海水浴场(2km),陆侃如冯沅君故居(2km),王正廷故居(2km),青岛贮水山儿童公园(2km),观海山公园(2km),青岛鲁迅公园(2km),小鱼山公园(2km),观象山公园(2km),青岛观象台(2km),王统照故居(2km),童第周故居(2km),梁实秋故居(2km),嘉禾路基督教堂(2km),南北岭基督教堂(2km),龙山路教堂(2km),青岛市北区清和路基督教堂(2km),李村基督教堂(2km),青岛市圣保罗教堂(2km),公主楼(2km),青岛天后宫(2km),青岛基督教堂(2km),汇泉广场(2km),台东步行街美食街(2km),青岛啤酒厂早期建筑(2km),青岛八大关近代建筑(2km),青岛植物园(2km),青岛信号山公园(2km),青岛德式官邸旧址（青岛迎宾馆）(2km),青岛海底世界(2km),湛山寺(2km),青岛市革命烈士纪念馆(2km),青岛德国监狱旧址博物馆(2km),青岛纺织博物馆(2km),骆驼祥子博物馆(2km),青岛市康有为故居纪念馆(2km),青岛市民俗博物馆(2km),青岛德国总督楼旧址博物馆(2km),青岛啤酒博物馆(2km),青岛水族馆(2km),太平角公园(3km),老舍公园(3km),青岛JOYPOLIS世嘉都市乐园(3km),东海路9号(3km),海航万邦中心(3km),小青岛(3km),青岛栈桥(3km),青岛万象城(3km),南园孔子纪念馆(3km),青岛火车站(3km),青岛花石楼(3km),嘉木美术馆(3km),劈柴院美食街(3km),青岛电影博物馆（1907光影俱乐部）(3km),山东曲阜孔子湖国家湿地公园(3km),青岛站(3km),青岛港(3km),亨达工业旅游区(3km),齐长城百果园(3km),沁楠香农业生态观光园(3km),万佳广场休闲旅游区(3km),青岛劈柴院(3km),青岛道路交通博物馆(3km),青岛口腔医学博物馆(3km),青岛邮电博物馆(3km),中国海军博物馆(3km),青岛世园会音乐喷泉(4km),汇泉公园(4km),八大峡公园(4km),青岛长途汽车站(4km),青岛卓越世纪中心(4km),远雄国际广场(4km),中铁青岛中心(4km),青岛市海泊河公园(4km),八大峡广场(4km),青岛音乐广场(4km),青岛五月的风(4km),五四广场(4km),青岛海滨风景区(4km),青岛消防博物馆(4km),青岛城市星光公园(5km),青岛民俗馆(5km),茶山滑雪场(5km),青岛颐中皇冠假日酒店(5km),青岛第一百盛广场(5km),青岛中银大厦(5km),刘若拙墓(5km),财贝沟东周墓群(5km),青岛土山屯墓群(5km),青岛市科技馆(5km),青岛气象度假村(5km),中共青岛地方支部旧址(5km),珊瑚贝连岛一号桥(5km),青岛市陈家贡湾特大桥(5km),丁字湾跨海大桥(5km),严力宾纪念馆(5km),凤凰之声大剧院(5km),青岛奥帆大剧场(5km),青岛市歌舞剧院(5km),胶澳总督府(5km),青岛百果山民族风情写生创作基地(5km),赞一美术馆(5km),青岛西海岸美术馆(5km),青岛油画院美术馆(5km),青岛画院美术馆(5km),青岛市美术馆(5km),中苑海上广场(5km),青岛机场站(5km),云霄路美食街(5km),青岛颐中体育场(5km),青岛德国建筑(5km),即墨故城遗址(5km),店埠民俗文化博物馆(5km),樱皇谷风景区(5km),胶州麻湾渔乐园(5km),青岛奥帆中心(5km),海云庵(5km),双星鞋文化博物馆(5km),中共青岛党史纪念馆(5km),奥帆博物馆(5km),嘉定山公园(6km),北岭山森林公园(6km),黄河三角洲农业高新技术产业示范区(6km),青岛观音寺(6km),浮山香苑公园(7km),四方奥林匹克体育公园(7km),青岛银海国际游艇俱乐部旅游区(7km),水清沟公园(8km),青岛极地恐龙游乐园（已停业）(9km),青岛极地海洋世界(9km),城市记忆・老街巷(10km),城市记忆・老街巷(10km)",,/RuoYi-Vue/coverpic/101.jpg
102,山东大学博物馆,综合类,山东省济南市历城区山大南路27号知新楼A座,0,13:30~16:30,,国家一级（行业）,,,58855,山东大学博物馆是以考古学系的文物标本室为基础，于1995年正式建立，老馆址位于山东大学东校区经管楼，由校史馆、教学科研成果馆、书画展和文物馆四部分组成。为纪念山东大学百年校庆，2001年10月13日，新馆在景色秀丽的西校区新落成的科技综合楼举行了隆重的开馆典礼。新建成的山东大学博物馆展出面积1200平方米，有山东大学百年校史展、蒋维菘书法艺术作品展、精品文物展和临展室共四个单元。古色古香的建筑，松柏环绕的环境与博物馆形成和谐的统一。,,山东省济南市山大南路27号山东大学中心校区知新楼A座27层,"山东大学(1km),洪家楼天主教堂(2km),黑虎泉(3km),济南环城公园(3km),宏济堂中医药文旅产业园(3km),济南宽厚里美食街(3km),济南大明湖(3km),济南市解放阁(3km),济南百花洲(4km),济南珍珠泉(4km),孙子故里(4km),山东省文化馆(4km),济南大观园小吃街(4km),济南芙蓉街(4km),大明湖海底世界(4km),山东美术馆(4km),山东省图书馆(4km),泉城广场(4km),山东省科技馆(4km),芙蓉街关帝庙(4km),济南1953・茶文化创意产业园(4km),泉城茶博园(4km),黄金谷山水画廊景区(4km),星期八小镇(4km),莲华山景区(4km),济南兴国禅寺(4km),山东省地质博物馆(4km),山东省石刻艺术博物馆(4km),山东博物馆(4km),济南市天下第一泉景区(4km),济南开元寺(5km),泉城公园(5km),五龙潭公园(5km),济南趵突泉(5km),万字会旧址(不对访客开放)(5km),中国共产党山东省党史陈列馆(5km),济南市博物馆(5km),济南千佛山风景名胜区(5km),济南兴教寺(6km),双乳山(济南市)(6km),济南奥体中心(6km),山东省邮电博物馆(6km),新疆孔雀河(7km),济南中山公园(7km),新疆薰衣草文化博物馆(7km),大辛庄遗址(7km),济南宏济堂博物馆(7km),济南战役纪念馆(7km),齐鲁钱币博物馆(7km),济南动物园(8km),山西路广场(8km),济南泺口黄河铁路大桥(8km),济南黄河森林公园(9km),济南百里黄河风景区(9km),济南药山(10km),济南药山(10km)",,/RuoYi-Vue/coverpic/102.jpg
103,济南市章丘区博物馆,综合类,山东省章丘区双山西路文博中心,0,08:00~18:00,,国家一级（文物）,,,58840,济南市章丘区博物馆是一所地方性综合博物馆，坐落于一处晚清典型章丘民居的建筑内。博物馆布局巧妙，设计合理，前厅后楼，南北贯通，东西对称，占地1139.97平方米，房屋43间。博物馆曾举办章丘简史展、章丘革命文物展、章丘史前文化陈列等陈列展览，陈列室共9间，展线108米，共展出文物700余件。章丘博物馆曾出版章丘博物馆简介、章丘文物志、章丘古文化序列、小荆山遗址调查报告等，还组织了“洛庄汉墓、危山汉墓出土文物精品展”以及“第三次全国文物普查图片展”等展览。,,"章丘市博物馆附近的公交站:

章丘市法院、住建委、电视台、文博中心、开发区管委会、公安局、双山办事处、电子学院路口、山水泉城、双山路口、双山大街南口、双山路口、政务大厅。

章丘市博物馆附近的公交车:

章丘6路、章丘10路、章丘3路、章丘5路、章丘11路、K301路、章丘4路等。

打车去章丘市博物馆多少钱：

济南市出租车的起步价是10.0元、起步距离3.0公里、 每公里2.0元、无燃油附加费 ，请参考。","山东百脉泉酒业景区(7km),朱家峪旅游区(7km),济南章丘锦屏山旅游休闲度假区(8km),元音寺(8km),小荆山遗址(9km),章丘市东方商人生态农庄景区(9km),济南植物园(9km),济南野生动物世界(9km),石匣兴隆寺(9km),石匣兴隆寺(9km)",,/RuoYi-Vue/coverpic/103.jpg
104,滕州市博物馆,历史类,山东省滕州市学院中路82号,0,09:00~17:00,,国家一级（文物）,,,58831,滕州市博物馆始建于1973年，占地面积20000平方米，是一所地方性历史博物馆。滕州市博物馆也是中国县（市）级馆中，收藏量最大的博物馆之一。在这里陈列展出了北辛文化、古薛国、古滕国等珍贵历史文物。建筑设计别致，风格独特，设备先进，功能齐全，为全国县级一流的博物馆。滕州市博物馆是集历史、艺术、人文为一体的综合性、多功能、现代化地方博物馆。1956年，滕县文化馆建立文物陈列室，1958年成立滕县博物馆，设“自然之部”、“历史之部”和“社建之部”3个陈列室，并有石刻碑廊一处，收藏文物500余件。,,滕州地理位置优越，交通便利。“104”国道、京沪铁路、京沪高铁纵贯南北，京台高速公路、京杭大运河穿境而过，形成了四通八达的公路、铁路、水运交通网络。滕州市区乘6路、9路、30路公交车即可到达,"滕州市鲁班纪念馆(3km),滕州市砚台博物馆(3km),滕州市墨子纪念馆(3km),王学仲艺术馆(3km),滕州市图书馆(5km),山东滕州滨湖国家湿地公园(5km),薛城遗址(5km),枣庄市滕州龙振庄园景点(5km),枣庄市滕州鲁班湿地公园(5km),滕州墨子湿地公园(5km),枣庄市滕州龙园古镇(5km),枣庄市滕州龙阳旅游区(7km),枣庄滕州盈泰温泉度假村(7km),枣庄滕州市滕国故城旅游区(9km),枣庄滕州市滕国故城旅游区(9km)",,/RuoYi-Vue/coverpic/104.jpg
105,曲阜市孔子博物院,综合类,山东省曲阜市东华门大街1号,40,09:00~17:00,,国家一级（文物）,,,58820,孔子博物馆位于曲阜城南北轴线大成路的正南端，与世界遗产三孔遥相呼应，由两院院士吴良镛先生规划设计，于2013年初正式动工，并于2013年底实现主馆封顶，预计2017年底建成。总建筑面积5.5万平方米，其中主馆4.2万平方米，东部平台1.3万平方米。主馆包括展陈面积1.7万平方米、文物库房面积7千平方米、文物修复中心面积1千平方米。该馆是具有时代标杆意义的重大文化工程，是孔子文化的集大成之所，是当代杰作，未来遗产。,,"公交路线：
乘坐６路、16路、20路、26路、28路、31路、101路公交车可直达济宁市博物老馆；
乘坐16路、16路大站快车、56路、20路公交车可到达济宁文化中心济宁市博物馆新馆。","曲阜奇秀视界3D魔幻艺术馆(2km),曲阜摩天轮主题公园(2km),曲阜沂河水利风景区(2km),济宁市曲阜孔子研究院(2km),济宁市曲阜蓼河十里儒家文化旅游景观带景区(2km),济宁孔子文化园(2km),济宁市曲阜明故城（孔庙、孔林和孔府）(2km),曲阜鲁国故城(3km),曲阜孔庙及孔府(3km),济宁市曲阜周公庙(3km),济宁曲阜颜庙景区(3km),曲阜汉碑汉画拓片博物馆(3km),曲阜孔府酒文化博物馆(3km),曲阜市汉魏碑刻陈列馆(3km),孔子故居(5km),景灵宫碑(5km),蓼河景区(5km),山东儒源儒家文化体验基地(5km),曲阜汉画艺术博物馆(5km),济宁曲阜寿丘少昊陵(6km),汉鲁王墓(8km),西夏侯遗址(8km),曲阜市银府生态文化园(8km),孟母林墓群(10km),邹城明鲁王陵旅游区(10km),邹城明鲁王陵旅游区(10km)",,/RuoYi-Vue/coverpic/105.jpg
106,济宁市博物馆,历史类,山东省济宁市任城区古槐路38号,0,,,国家一级（文物）,,3A,58817,济宁市博物馆位于山东省济宁市任城区，始建于1985年5月16日，经过多年的发展，博物馆已初具规模，馆舍占地31亩，由两部分组成，东部为铁塔寺，始建于北齐皇建元年（公元560年），1988年被国务院公布为全国重点文物保护单位；西部为仿古建筑。馆舍总建筑面积11000平方米，其中主展楼8831平方米，用于展览的实用面积3000平方米，库房2600平方米。济宁博市物馆保存的古建筑有宋代铁塔、明代大雄宝殿、钟楼及僧王祠、汉碑馆等，为全国重点文物保护单位。,,山东省济宁市城区古槐路38号。,"崇觉寺铁塔(1km),慈孝兼完坊(1km),济宁人民公园・太白楼景区(1km),济宁市李白纪念馆(1km),上磨石岭民俗村(2km),石鼓墩景区(2km),颐现代农业风情园(2km),郭尚书林景区(2km),金钢山酒文化旅游区(2km),狼舞山景区(2km),济宁青华洞景区(2km),五里三贤景区(2km),济宁顺河东大寺(2km),济宁市南池景区(2km),大悲庵（山东省济宁市）(4km),济宁市任城区香樟园酒店(5km),葫芦套民俗风景区(5km),小孟镇孟里老家(5km),济宁任城古床榻博物馆(5km),济宁体育中心(6km),济宁天工园景区(7km),萧王庄墓群(7km),济宁城市展示馆(7km),济宁城市展示馆(7km)",,/RuoYi-Vue/coverpic/106.jpg
107,烟台市博物馆,综合类,山东省烟台市芝罘区毓岚街2号,0,09:00~16:00,,国家一级（文物）,,,58815,烟台市博物馆成立于1958年，现有馆址两处，原址位于全国重点文物保护单位福建会馆(烟台市民俗博物馆)，新址位于南大街61号博物馆新馆。新馆建筑面积17000平方米，总投资1.6亿元，位于烟台市中心文化广场最西端，于2007年立项，2009年开工建设。整体建筑分为地下一层、地上四层。包括文物库房、多功能报告厅、大厅、展厅、茶座、4D影院、办公区、阅览区等部分，是一座集中反映烟台人文历史和文化艺术的综合性现代化博物馆。,,路线：乘坐1路，2路5路52路公交车华联商厦站，碧海大厦站下车。,"烟台福建会馆(1km),毓璜顶公园(1km),烟台南山公园(2km),烟台山近代建筑群(2km),大悦城(2km),广仁路开埠文化旅游区　(2km),烟台山旅游景区(2km),烟台钢琴博物馆(2km),北极星钟表文化博物馆(2km),烟台美术博物馆(2km),烟台张裕酒文化博物馆(2km),白石村遗址(3km),张裕公司酒窖(3km),烟台月亮湾(4km),烟台芝罘大沽夹河水利风景区(4km),烟台西炮台(4km),山东核电科技馆(4km),东炮台公园(4km),烟台黑尚莓酒庄(4km),烟台西弗拉姆酒堡(4km),烟台塔山风景区　(4km),竹林寺（山东省烟台市）(5km),烟台海昌雨岱山温泉(6km),烟台海昌渔人码头旅游景区(6km),山东烟台山国家级海洋公园(8km),千里岩(10km),莱山胶东文化广场(10km),烟台市体育公园(10km),烟台市体育公园(10km)",,/RuoYi-Vue/coverpic/107.jpg
108,齐国故城遗址博物馆,历史类,山东省临淄区齐都镇张皇路7号,30,08:00~18:00,1小时,国家一级（文物）,,3A,58812,齐国故城遗址博物馆原位于齐国故城宫城遗址东部，1997年成立，陈列面积1500平方米，是以齐国故城大城与小城相互衔接的特殊形制作外形，青砖砌垒，形似古代城堡。总建筑面积2600平方米，顶高15米，四周有宫殿建筑遗址桓公台、齐故城城墙遗址、排水道口、东周墓殉马坑、孔子闻韶处、晏婴墓、三士冢、稷下学宫、营丘故城等众多遗址。齐国故城遗址博物馆座落于世界足球起源地、国家历史文化名城―临淄。齐国故城是国务院公布的首批全国重点文物保护单位，共有48处重点遗址，素有“地下博物馆”之美誉。,,"公交：乘20或6路公共汽车到临淄车站，转乘乘坐26、28、52路公交车在齐国历史博物馆站下车即到。

自驾：济青高速-临淄出口下-临淄北外环向东行驶-第二路口左拐-齐都镇-按景区路标行驶即到，下高速后约需10分钟车程。","临淄墓群(2km),后李遗址(4km),临淄中国古车博物馆(5km),淄博市太公湖水利风景区(6km),田齐王陵(6km),临淄齐国故城(6km),临淄足球博物馆(6km),淄博姜太公祠(7km),淄博临淄管仲纪念馆(8km),桐林遗址(10km),桐林遗址(10km)",,/RuoYi-Vue/coverpic/108.jpg
109,青岛啤酒博物馆,自然科学类,山东省青岛市市北区登州路56号,50,08:00~18:00,2~3小时,国家一级（行业）,,4A,58811,青岛啤酒博物馆，位于中国青岛市市北区登州路，是在国家重点文物保护单位青岛啤酒厂早期建筑的基础上建设而成的，也是中国一家以啤酒为主题的的博物馆。博物馆展出面积达6000余平方米，以青岛啤酒的百年历程及工艺流程为主线，浓缩了中国啤酒工业及青岛啤酒的发展史，具备了旅游的知识性、娱乐性、参与性等特点，体现了世界视野、民族特色、穿透历史、融汇生活的文化理念。,,青岛市内乘坐11、15、25、30、104、119、205、217、219、221、225、302、307、308、367、604路在“延安一路”站、“15中”站或“台东”站下车即到。,"青岛啤酒厂早期建筑(1km),青岛葡萄酒博物馆(1km),青岛纺织博物馆(1km),青岛山公园(2km),青岛贮水山儿童公园(2km),青岛欢动世界(2km),青岛动物园(2km),青岛中山公园(2km),洪深故居(2km),青岛市圣保罗教堂(2km),红岛站(2km),青岛植物园(2km),万佳广场休闲旅游区(2km),青岛山炮台教育基地(2km),青岛电视塔（青岛旅游观光塔）(2km),青岛琅琊台博物馆(2km),青岛市革命烈士纪念馆(2km),青岛山炮台遗址展览馆(2km),青岛第一海水浴场(3km),老舍公园(3km),陆侃如冯沅君故居(3km),观海山公园(3km),小鱼山公园(3km),观象山公园(3km),青岛观象台(3km),青岛长途汽车站(3km),青岛市海泊河公园(3km),南园孔子纪念馆(3km),王统照故居(3km),童第周故居(3km),梁实秋故居(3km),嘉禾路基督教堂(3km),南北岭基督教堂(3km),龙山路教堂(3km),青岛市北区清和路基督教堂(3km),李村基督教堂(3km),公主楼(3km),青岛天后宫(3km),青岛基督教堂(3km),嘉木美术馆(3km),汇泉广场(3km),劈柴院美食街(3km),青岛电影博物馆（1907光影俱乐部）(3km),山东曲阜孔子湖国家湿地公园(3km),青岛八大关近代建筑(3km),青岛港(3km),亨达工业旅游区(3km),齐长城百果园(3km),沁楠香农业生态观光园(3km),青岛劈柴院(3km),青岛信号山公园(3km),青岛德式官邸旧址（青岛迎宾馆）(3km),青岛海底世界(3km),湛山寺(3km),青岛道路交通博物馆(3km),青岛口腔医学博物馆(3km),青岛邮电博物馆(3km),青岛德国监狱旧址博物馆(3km),骆驼祥子博物馆(3km),青岛市康有为故居纪念馆(3km),青岛市民俗博物馆(3km),青岛德国总督楼旧址博物馆(3km),青岛水族馆(3km),青岛世园会音乐喷泉(4km),太平角公园(4km),汇泉公园(4km),王正廷故居(4km),青岛JOYPOLIS世嘉都市乐园(4km),青岛鲁迅公园(4km),青岛城市星光公园(4km),青岛民俗馆(4km),茶山滑雪场(4km),青岛卓越世纪中心(4km),东海路9号(4km),青岛第一百盛广场(4km),远雄国际广场(4km),中铁青岛中心(4km),海航万邦中心(4km),青岛中银大厦(4km),刘若拙墓(4km),财贝沟东周墓群(4km),青岛土山屯墓群(4km),青岛市科技馆(4km),青岛气象度假村(4km),中共青岛地方支部旧址(4km),小青岛(4km),青岛栈桥(4km),青岛万象城(4km),珊瑚贝连岛一号桥(4km),青岛市陈家贡湾特大桥(4km),丁字湾跨海大桥(4km),严力宾纪念馆(4km),凤凰之声大剧院(4km),青岛奥帆大剧场(4km),青岛市歌舞剧院(4km),胶澳总督府(4km),青岛火车站(4km),青岛花石楼(4km),青岛百果山民族风情写生创作基地(4km),赞一美术馆(4km),青岛西海岸美术馆(4km),青岛油画院美术馆(4km),青岛画院美术馆(4km),青岛市美术馆(4km),中苑海上广场(4km),青岛音乐广场(4km),青岛机场站(4km),青岛颐中体育场(4km),青岛五月的风(4km),青岛站(4km),五四广场(4km),青岛德国建筑(4km),即墨故城遗址(4km),店埠民俗文化博物馆(4km),樱皇谷风景区(4km),胶州麻湾渔乐园(4km),青岛海滨风景区(4km),海云庵(4km),中共青岛党史纪念馆(4km),青岛消防博物馆(4km),中国海军博物馆(4km),八大峡公园(5km),嘉定山公园(5km),北岭山森林公园(5km),八大峡广场(5km),云霄路美食街(5km),青岛奥帆中心(5km),青岛观音寺(5km),双星鞋文化博物馆(5km),四方奥林匹克体育公园(6km),青岛颐中皇冠假日酒店(6km),黄河三角洲农业高新技术产业示范区(6km),奥帆博物馆(6km),浮山香苑公园(7km),水清沟公园(7km),青岛银海国际游艇俱乐部旅游区(7km),青岛极地恐龙游乐园（已停业）(9km),城市记忆・老街巷(9km),青岛极地海洋世界(9km),青岛极地海洋世界(9km)",,/RuoYi-Vue/coverpic/109.jpg
110,济南市博物馆,综合类,山东省历下区经十一路30号,0,8:30~16:30,1小时,国家一级（文物）,,,58808,济南市博物馆是一所山东省大型地方综合性博物馆，是国家二级博物馆，位于济南市历下区经十一路30号。该馆始建于1958年12月，1997年，济南市博物馆新馆正式投入使用。2008年，济南市博物馆向全社会实施免费开放。2009年，被评定为国家二级博物馆。该博物馆占地面积8500平方米，建筑面积6300平方米，其中陈列面积2400平方米。主要担负全市可移动文物的收藏保管、陈列宣传和科学研究工作。设有保管部、陈列宣教部、保卫科和行政办公室。,,乘车路线：可乘64路、K54路、66路、85路、44路在千佛山西门站下车。,"山东省文化馆(1km),济南兴国禅寺(1km),泉城广场(2km),山东省科技馆(2km),万字会旧址(不对访客开放)(2km),山东省石刻艺术博物馆(2km),济南千佛山风景名胜区(2km),新疆孔雀河(3km),济南百花洲(3km),黑虎泉(3km),济南珍珠泉(3km),济南环城公园(3km),新疆薰衣草文化博物馆(3km),孙子故里(3km),宏济堂中医药文旅产业园(3km),济南大观园小吃街(3km),济南宽厚里美食街(3km),济南芙蓉街(3km),五龙潭公园(3km),济南市解放阁(3km),济南趵突泉(3km),芙蓉街关帝庙(3km),中国共产党山东省党史陈列馆(3km),济南战役纪念馆(3km),济南中山公园(4km),济南开元寺(4km),大明湖海底世界(4km),济南大明湖(4km),山西路广场(4km),山东省图书馆(4km),济南1953・茶文化创意产业园(4km),泉城茶博园(4km),黄金谷山水画廊景区(4km),星期八小镇(4km),莲华山景区(4km),山东省邮电博物馆(4km),齐鲁钱币博物馆(4km),济南市天下第一泉景区(4km),汉济北王墓群(5km),济南宏济堂博物馆(5km),山东大学博物馆(5km),山东省地质博物馆(5km),山东大学(5km),洪家楼天主教堂(6km),山东美术馆(7km),山东博物馆(7km),济南动物园(8km),山东月亮湾国家湿地公园(8km),济南泺口黄河铁路大桥(8km),济南兴教寺(9km),济南森林公园(9km),双乳山(济南市)(9km),济南奥体中心(9km),济南黄河森林公园(10km),济南药山(10km),济南百里黄河风景区(10km),济南百里黄河风景区(10km)",,/RuoYi-Vue/coverpic/110.jpg
111,潍坊市博物馆,综合类,山东省潍坊市东风东街6616号,0,09:00~17:00,,国家一级（文物）,,2018年（2A）,58805,潍坊市博物馆（Weifang Museum）位于潍坊市东风东街6616号，是一座古建筑风格的地方大型综合性博物馆。馆藏文物近8万件，藏品种类涵盖化石、陶器、瓷器、青铜、玉石、钱币、古角牙木、书画、碑拓、古籍、碑刻、造像、织绣、玺印符牌、民俗服饰及饰品、近现代革命文物等33类。潍坊市博物馆始建于1962年，原馆址设在全国重点文物保护单位著名的“十笏园”内。新馆位于潍坊市东部环境优美的开发区。新馆于1995年4月15日开工建设，历时5年，于1999年12月20日落成开馆。,,公交：乘坐公交25、30、31、52、81路至潍柴宾馆站下。,"坊子新方炭矿博物馆(1km),富华游乐园(1km),潍坊鸢都红木嵌银漆器博物馆(1km),潍坊伊利乳业(3km),潍坊市奎文区大虞文化村(3km),峡山水中央公园(3km),五龙湖景区(3km),山东省潍坊市艺术馆(4km),风筝广场(5km),潍坊市奎文区图书馆(5km),十笏园(5km),奎文区东方新世纪乐园(5km),潍坊十笏园文化街区(5km),潍坊风筝博物馆(5km),潍坊十笏园博物馆(5km),郭味蕖故居陈列馆(6km),陈介祺故居陈列馆(6km),潍城区中华茶博城(7km),浞河景区(7km),金宝乐园(7km),金泉寺（山东省潍坊市）(7km),潍坊市北辰绿洲湿地公园(8km),杨家埠民间艺术大观园(8km),山东潍坊禹王国家湿地公园(9km),山东潍坊白浪河国家湿地公园(9km),潍坊市白浪河水利风景区(9km),白浪绿洲湿地公园(9km),白浪绿洲湿地公园(9km)",,/RuoYi-Vue/coverpic/111.jpg
